COD_PROVINCIA;NOM_PROVINCIA;COD_CIRCUNSCRIPCION;NOM_CIRCUNSCRIPCION;COD_CANTON;NOM_CANTON;COD_PARROQUIA;NOM_PARROQUIA;EST_PARROQUIA;COD_ZONA;NOM_ZONA;COD_RECINTO;NOM_RECINTO
7;EL ORO;0;;370;PIÑAS;2230;LA BOCANA;R;0;;3068;ESCUELA DE EDUCACION BASICA DR. MIGUEL MORENO ORDOÑEZ
7;EL ORO;0;;370;PIÑAS;2465;MOROMORO;R;1;MOROMORO;3046;COLISEO DE DEPORTES OSWALDO LOAYZA SANCHEZ
7;EL ORO;0;;370;PIÑAS;2465;MOROMORO;R;2;PALO SOLO;2743;ESCUELA DE EDUCACION BASICA PEDRO FERMIN CEVALLOS
7;EL ORO;0;;370;PIÑAS;2850;PIEDRAS;R;1;PIEDRAS;3030;ESCUELA DE EDUCACION BASICA 8 DE NOVIEMBRE
7;EL ORO;0;;370;PIÑAS;2850;PIEDRAS;R;2;EL CARMEN;3033;ESCUELA DE EDUCACION BASICA REPUBLICA DE COLOMBIA
7;EL ORO;0;;370;PIÑAS;3650;SAN ROQUE;R;0;;3038;ESCUELA DE EDUCACION BASICA DR. GUILLERMO GUZMAN AYORA
7;EL ORO;0;;370;PIÑAS;5790;PIÑAS;U;0;;23;COLEGIO DE BACHILLERATO 8 DE NOVIEMBRE
7;EL ORO;0;;370;PIÑAS;5790;PIÑAS;U;0;;27;ESCUELA DE EDUCACION GENERAL BÁSICA DR FEDERICO GONZALEZ SUAREZ
7;EL ORO;0;;370;PIÑAS;5790;PIÑAS;U;0;;41;COLEGIO NACIONAL TECNICO LEOVIGILDO LOAYZA LOAYZA
7;EL ORO;0;;370;PIÑAS;5790;PIÑAS;U;0;;6254;ESCUELA DE EDUCACIÓN BÁSICA TERESA MOLINA DE MUÑOZ
7;EL ORO;0;;370;PIÑAS;5790;PIÑAS;U;0;;1;ESCUELA DE EDUCACION BASICA CRISTOBAL COLON
7;EL ORO;0;;370;PIÑAS;5790;PIÑAS;U;0;;22;UNIDAD EDUCATIVA DR GONZALO ABAD GRIJALVA
7;EL ORO;0;;370;PIÑAS;6675;PIÑAS GRANDE;U;0;;3036;ESCUELA DE EDUCACION BASICA DR. LUIS CORDERO CRESPO
7;EL ORO;0;;370;PIÑAS;6680;LA SUSAYA;U;0;;3024;COLEGIO DE BELLAS ARTES ANTONIO DE JESUS HIDALGO
7;EL ORO;0;;375;ARENILLAS;805;CHACRAS;R;0;;2143;ESCUELA SOLDADO JOSÉ DÍAZ
7;EL ORO;0;;375;ARENILLAS;1695;CARCABON;R;0;;2139;ESCUELA JESÚS MARÍA YEPEZ
7;EL ORO;0;;375;ARENILLAS;2715;PALMALES;R;1;PALMALES;1047;COLEGIO ABDON CADERON MUÑOZ
7;EL ORO;0;;375;ARENILLAS;2715;PALMALES;R;2;MANABI DE EL ORO;2135;ESCUELA 9 DE OCTUBRE
7;EL ORO;0;;375;ARENILLAS;4650;LA CUCA;R;1;LA CUCA;2102;ESCUELA DE EDUCACION BASICA AMAZONAS
7;EL ORO;0;;375;ARENILLAS;4650;LA CUCA;R;2;LOS GUAYACANES;4610;ESCUELA DE EDUCACION BASICA NAPOLEON PALADINES CARREÑO
7;EL ORO;0;;375;ARENILLAS;5040;ARENILLAS;U;0;;1254;COLEGIO TECNICO ARENILLAS
7;EL ORO;0;;375;ARENILLAS;5040;ARENILLAS;U;0;;1241;ESCUELA DE EDUCACION BASICA CIUDAD DE QUITO
7;EL ORO;0;;375;ARENILLAS;5040;ARENILLAS;U;0;;6207;ESCUELA DE EDUCACIÓN BÁSICA ONCE DE NOVIEMBRE
7;EL ORO;0;;375;ARENILLAS;5040;ARENILLAS;U;0;;1235;ESCUELA DE EDUCACION BASICA CIUDAD DE ARENILLAS
7;EL ORO;0;;375;ARENILLAS;5040;ARENILLAS;U;0;;6185;COLEGIO DE BACHILLERATO DR CAMILO GALLEGOS DOMINGUEZ
7;EL ORO;0;;380;EL GUABO;245;LA IBERIA;R;0;;45;ESCUELA GUADALUPE FERNANDEZ DE CASTRO
7;EL ORO;0;;380;EL GUABO;300;BARBONES;R;0;;1534;ESCUELA PROVINCIA DE LOS RIOS
7;EL ORO;0;;380;EL GUABO;2050;RIO BONITO;R;1;RIO BONITO;2115;ESCUELA FISCAL MIXTA DR. CARLOS CORNEJO ORBE
7;EL ORO;0;;380;EL GUABO;2050;RIO BONITO;R;2;SAN MIGUEL DE BRAZIL;3034;CASA COMUNAL DE SAN MIGUEL DE BRAZIL
7;EL ORO;0;;380;EL GUABO;2050;RIO BONITO;R;3;SAN VICENTE;3037;ESCUELA DE EDUCACIÓN BÁSICA 30 DE AGOSTO
7;EL ORO;0;;380;EL GUABO;2050;RIO BONITO;R;4;PAGUA;434;ESCUELA FISCAL MIXTA DR. EUGENIO ESPEJO
7;EL ORO;0;;380;EL GUABO;4000;TENDALES;R;1;TENDALES;414;UNIDAD EDUCATIVA DEL MILENIO GRAL ELOY ALFARO DELGADO
7;EL ORO;0;;380;EL GUABO;4000;TENDALES;R;2;BAJO ALTO;2116;ESCUELA DE EDUCACION BASICA JAMBELI
7;EL ORO;0;;380;EL GUABO;5340;EL GUABO;U;1;EL GUABO;24;ESCUELA DE EDUCACIÓN BÁSICA GENERAL MANUEL SERRANO RENDA
7;EL ORO;0;;380;EL GUABO;5340;EL GUABO;U;1;EL GUABO;40;UNIDAD EDUCATIVA DR JOSE MARIA VELASCO IBARRA
7;EL ORO;0;;380;EL GUABO;5340;EL GUABO;U;1;EL GUABO;29;ESCUELA DE EDUCACION BASICA OSCAR EFREN REYES
7;EL ORO;0;;380;EL GUABO;5340;EL GUABO;U;1;EL GUABO;43;ESCUELA DE EDUCACION BASICA ZOILA UGARTE DE LANDIVAR
7;EL ORO;0;;380;EL GUABO;5340;EL GUABO;U;1;EL GUABO;5910;COLEGIO DE BACHILLERATO DR JOSE MIGUEL GARCIA MORENO
7;EL ORO;0;;380;EL GUABO;5340;EL GUABO;U;1;EL GUABO;5909;UNIDAD DE EDUCACIÓN ESPECIALIZADA SAN ANTONIO DE PADUA
7;EL ORO;0;;380;EL GUABO;5340;EL GUABO;U;2;TILLALES;2090;ESCUELA DE EDUCACION BASICA PROVINCIA DE EL ORO
7;EL ORO;0;;380;EL GUABO;5340;EL GUABO;U;3;EL RETIRO;3313;ESCUELA DE EDUCACION BASICA 15 DE MAYO
7;EL ORO;0;;585;CHILLA;5715;CHILLA;U;1;CHILLA;1131;UNIDAD EDUCATIVA CHILLA
7;EL ORO;0;;585;CHILLA;5715;CHILLA;U;2;PLAYAS DE DAUCAY;3048;ESCUELA LAURO DAVILA ECHEVERRIA
7;EL ORO;0;;585;CHILLA;5715;CHILLA;U;3;PEJEYACU;3029;ESCUELA 25 DE JULIO
7;EL ORO;0;;585;CHILLA;5715;CHILLA;U;4;DUMARI;3031;ESCUELA DE EDUCACION BASICA DR. EDMUNDO CARBO
7;EL ORO;0;;585;CHILLA;5715;CHILLA;U;5;CARABOTA;4971;POLIDEPORTIVO CARABOTA
7;EL ORO;0;;690;PORTOVELO;740;CURTINCAPAC;R;0;;3053;UNIDAD EDUCATIVA CURTINCAPAC
7;EL ORO;0;;690;PORTOVELO;3275;SALATI;R;0;;3069;UNIDAD EDUCATIVA MIGUEL ANGEL CORRAL
7;EL ORO;0;;690;PORTOVELO;4520;MORALES;R;0;;3067;ESCUELA DE EDUCACION BASICA GABRIEL GARCIA MORENO
7;EL ORO;0;;690;PORTOVELO;5850;PORTOVELO;U;0;;1179;UNIDAD EDUCATIVA 13 DE MAYO
7;EL ORO;0;;690;PORTOVELO;5850;PORTOVELO;U;0;;1199;ESCUEA FISCAL JOHN DEWEY
7;EL ORO;0;;690;PORTOVELO;5850;PORTOVELO;U;0;;1200;ESCUELA DE EDUCACIÓN BASICA FEDERICO FROEBEL
7;EL ORO;0;;690;PORTOVELO;5850;PORTOVELO;U;0;;6272;COLEGIO DE BACHILLERATO CIUDAD DE PORTOVELO
7;EL ORO;0;;695;HUAQUILLAS;6800;HUALTACO;U;0;;4150;UNIDAD DE EDUCACION BASICA CLEMENCIA GRANDA
7;EL ORO;0;;695;HUAQUILLAS;6805;MILTON REYES;U;0;;340;ESCUELA FISCAL CAPITAN CESAR EDMUNDO CHIRIBOGA
7;EL ORO;0;;695;HUAQUILLAS;6805;MILTON REYES;U;0;;1076;ESCUELA FISCAL MIXTA GENERAL VICENTE ANDA AGUIRRE
7;EL ORO;0;;695;HUAQUILLAS;6805;MILTON REYES;U;0;;21;ESCUELA DE EDUCACION BASICA REPUBLICA DEL ECUADOR
7;EL ORO;0;;695;HUAQUILLAS;6805;MILTON REYES;U;0;;4155;COLEGIO NACIONAL SARA SERRANO DE MARIDUEÑA
7;EL ORO;0;;695;HUAQUILLAS;6805;MILTON REYES;U;0;;6203;ESCUELA DE EDUCACIÓN BÁSICA JACINTA VALDIVIEZO BANEGAS
7;EL ORO;0;;695;HUAQUILLAS;6805;MILTON REYES;U;0;;6226;ESCUELA DE EDUCACIÓN BÁSICA RODRIGO CHAVEZ GONZALEZ
7;EL ORO;0;;695;HUAQUILLAS;6810;EL PARAISO;U;0;;403;ESCUELA FISCAL MIXTA DRA MATILDE HIDALGO DE PROCEL
7;EL ORO;0;;695;HUAQUILLAS;6810;EL PARAISO;U;0;;4152;UNIDAD DE EDUCATIVA CIUDAD DE HUAQUILLAS
7;EL ORO;0;;695;HUAQUILLAS;6815;ECUADOR;U;0;;1279;COLEGIO REMIGIO GEO GOMEZ GUERRERO
7;EL ORO;0;;695;HUAQUILLAS;6815;ECUADOR;U;0;;367;ESCUELA FISCAL MIXTA PRIMERO DE OCTUBRE
7;EL ORO;0;;695;HUAQUILLAS;6815;ECUADOR;U;0;;2101;"UNIDAD DE EDUCACION ESPECIALIZADA ""HUAQUILLAS"""
7;EL ORO;0;;695;HUAQUILLAS;6815;ECUADOR;U;0;;6221;COLEGIO DE BACHILLERATO HUAQUILLAS
7;EL ORO;0;;695;HUAQUILLAS;6820;UNION LOJANA;U;0;;4154;ESCUELA DE EDUCACION JAIME ROLDOS AGUILERA
7;EL ORO;0;;695;HUAQUILLAS;6820;UNION LOJANA;U;0;;6227;ESCUELA DE EDUCACIÓN BÁSICA CLOTARIO IÑIGUEZ LUZURIAGA
7;EL ORO;0;;705;ATAHUALPA;225;AYAPAMBA;R;0;;2669;COLISEO DE DEPORTE DE AYAPAMBA
7;EL ORO;0;;705;ATAHUALPA;375;SAN JUAN DE CERRO AZUL;R;0;;3023;ESCUELA DE EDUCACION BASICA ODALIA ARAUZ
7;EL ORO;0;;705;ATAHUALPA;4480;CORDONCILLO;R;0;;3019;ESCUELA DE EDUCACION BASICA REPUBLICA DE MEXICO
7;EL ORO;0;;705;ATAHUALPA;4530;SAN JOSE;R;0;;2735;ESCUELA DE EDUCACION BASICA DR. CARLOS REYES ANDRADE
7;EL ORO;0;;705;ATAHUALPA;4535;MILAGRO;R;0;;2739;COLISEO DE DEPORTES MILAGRO
7;EL ORO;0;;705;ATAHUALPA;5745;PACCHA;U;0;;1132;COLEGIO ANGEL TINOCO RUIZ
7;EL ORO;0;;755;LAS LAJAS;1075;SAN ISIDRO;R;0;;2758;UNIDAD EDUCATIVA JUAN LEON MERA
7;EL ORO;0;;755;LAS LAJAS;1080;EL PARAISO;R;1;EL PARAISO;3039;ESCUELA DE EDUCACION BASICA PROVINCIA DEL TUNHURAGUA
7;EL ORO;0;;755;LAS LAJAS;1080;EL PARAISO;R;2;EL TIGRE 1;2753;ESCUELA DE EDUCACION BASICA DOLORES CARREÑO DE MORA
7;EL ORO;0;;755;LAS LAJAS;1100;LA LIBERTAD;R;1;LA LIBERTAD;2752;ESCUELA DR. JOSE MARIA VELASCO IBARRA
7;EL ORO;0;;755;LAS LAJAS;1100;LA LIBERTAD;R;2;PUYANGO DE LA LIBERTAD;2682;ESCUELA DE EDUCACION BASICA JORGE YEPEZ CARRANZA
7;EL ORO;0;;755;LAS LAJAS;6335;LA VICTORIA/LAS LAJAS;U;0;;1251;ESCUELA DE EDUCACION BASICA CIUDAD DE LOJA
7;EL ORO;0;;755;LAS LAJAS;6335;LA VICTORIA/LAS LAJAS;U;0;;6237;COLEGIO DE BACHILLERATO EUGENIO ESPEJO
7;EL ORO;0;;755;LAS LAJAS;6950;PLATANILLOS;U;1;PLATANILLOS;2759;UNIDAD EDUCATIVA BÁSICA PADRE JUAN DE VELASCO
7;EL ORO;0;;755;LAS LAJAS;6950;PLATANILLOS;U;2;VALLE HERMOSO;3088;POLIDEPORTIVO VALLE HERMOSO
7;EL ORO;0;;860;MARCABELI;160;EL INGENIO;R;0;;2737;ESCUELA DE EDUCACIÓN BÁSICA DR. JORGE ZAVALA BAQUERIZO
7;EL ORO;0;;860;MARCABELI;6570;MARCABELI;U;0;;430;ESCUELA DE EDUCACIÓN BASICA FEBRES CORDERO
7;EL ORO;0;;860;MARCABELI;6570;MARCABELI;U;0;;6017;ESCUELA DE EDUCACIÓN BÁSICA LUIS ENRIQUE CORDOVA
7;EL ORO;0;;875;BALSAS;1975;BELLAMARIA;R;0;;2671;UNIDAD EDUCATIVA BELLAMARIA
7;EL ORO;0;;875;BALSAS;6590;BALSAS;U;0;;1083;COLEGIO DE BACHILLERATO GENERAL VICENTE ANDA AGUIRRE
7;EL ORO;0;;875;BALSAS;6590;BALSAS;U;0;;6016;ESCUELA DE EDUCACIÓN BÁSICA PROVINCIA NAPO PASTAZA
8;ESMERALDAS;0;;560;ESMERALDAS;450;CAMARONES;R;0;;1208;"UNIDAD EDUCATIVA ""DR. FRANKLIN TELLO"""
8;ESMERALDAS;0;;560;ESMERALDAS;450;CAMARONES;R;0;;6183;COLISEO PARROQUIA CAMARONES
8;ESMERALDAS;0;;560;ESMERALDAS;655;CRNL.CARLOS CONCHA TORRES;R;0;;3878;"ESCUELA GENERAL BASICA ""JARDIN DE LA INFANCIA"""
8;ESMERALDAS;0;;560;ESMERALDAS;895;CHINCA;R;0;;1109;EXTENSION DEL MILENIUM CHINCA /ANTES UNIDAD EDUCATIVA BARTOLOMÉ RUIZ
8;ESMERALDAS;0;;560;ESMERALDAS;895;CHINCA;R;0;;6068;UNIDAD EDUCATIVA DEL MILENIUM CHINCA
8;ESMERALDAS;0;;560;ESMERALDAS;2320;MAJUA;R;0;;1194;"ESCUELA GENERAL BASICA ""GUAYAS"""
8;ESMERALDAS;0;;560;ESMERALDAS;3570;SAN MATEO;R;1;SAN MATEO;1911;UNIDAD EDUCATIVA SAN MATEO / ANTES ESCUELA BOLIVIA
8;ESMERALDAS;0;;560;ESMERALDAS;3570;SAN MATEO;R;1;SAN MATEO;6043;UNIDAD EDUCATIVA SAN MATEO
8;ESMERALDAS;0;;560;ESMERALDAS;3570;SAN MATEO;R;2;TIMBRE;3450;"ESCUELA GENERAL BÁSICA ""DR. RICARDO PAREDES ROMERO"""
8;ESMERALDAS;0;;560;ESMERALDAS;3930;TABIAZO;R;0;;1250;UNIDAD EDUCATIVA FISCAL TABIAZO / ANTES ESCUELA GRANJA JOSE SAN MARTIN
8;ESMERALDAS;0;;560;ESMERALDAS;3940;TACHINA;R;0;;1149;ESCUELA GENERAL BASICA PEDRO CORNELIO DROUET
8;ESMERALDAS;0;;560;ESMERALDAS;4240;VUELTA LARGA;R;0;;52;"UNIDAD EDUCATIVA ""LEON FEBRES CORDERO"""
8;ESMERALDAS;0;;560;ESMERALDAS;4240;VUELTA LARGA;R;0;;6166;PARQUE CENTRAL SIMON BOLIVAR
8;ESMERALDAS;0;;560;ESMERALDAS;4240;VUELTA LARGA;R;0;;6133;ESCUELA EGB CESAR NAVIL ESTUPIÑAN BASS
8;ESMERALDAS;0;;560;ESMERALDAS;5205;BARTOLOME RUIZ;U;0;;1302;"UNIDAD EDUCATIVA FISCOMISIONAL ""CRISTO REY"""
8;ESMERALDAS;0;;560;ESMERALDAS;5205;BARTOLOME RUIZ;U;0;;1650;"UNIDAD EDUCATIVA ""DR. LUIS PRADO VITERI"" \ ANTES COMPLEJO LEONIDAS MARIO DROUET"
8;ESMERALDAS;0;;560;ESMERALDAS;5205;BARTOLOME RUIZ;U;0;;4988;UNIDAD EDUCATIVA MANUEL NIETO CADENA
8;ESMERALDAS;0;;560;ESMERALDAS;5205;BARTOLOME RUIZ;U;0;;6022;IGLESIA SANTA MARIANITA
8;ESMERALDAS;0;;560;ESMERALDAS;5205;BARTOLOME RUIZ;U;0;;6044;UNIDAD EDUCATIVA SAN JOSE BENITO COTTOLENGO
8;ESMERALDAS;0;;560;ESMERALDAS;5205;BARTOLOME RUIZ;U;0;;6128;UNIVERSIDAD TECNICA LUIS VARGAS TORRES
8;ESMERALDAS;0;;560;ESMERALDAS;5210;5 DE AGOSTO;U;1;5 DE AGOSTO;1283;UNIDAD EDUCATIVA PARTICULAR LA INMACULADA
8;ESMERALDAS;0;;560;ESMERALDAS;5210;5 DE AGOSTO;U;1;5 DE AGOSTO;1067;UNIDAD EDUCATIVA FISCAL LUIS VARGAS TORRES
8;ESMERALDAS;0;;560;ESMERALDAS;5210;5 DE AGOSTO;U;1;5 DE AGOSTO;1291;UNIDAD EDUCATIVA RAMON BEDOYA NAVIA/ANTES ESCUELA FRAY VICENTE SOLANO
8;ESMERALDAS;0;;560;ESMERALDAS;5210;5 DE AGOSTO;U;1;5 DE AGOSTO;1063;UNIDAD EDUCATIVA FISCAL MARGARITA CORTEZ
8;ESMERALDAS;0;;560;ESMERALDAS;5210;5 DE AGOSTO;U;1;5 DE AGOSTO;1733;"UNIDAD EDUCATIVA NELSON ORTIZ ESTAFANUTO / ANTES ESCUELA ""5 DE AGOSTO"""
8;ESMERALDAS;0;;560;ESMERALDAS;5210;5 DE AGOSTO;U;1;5 DE AGOSTO;605;"UNIDAD EDUCATIVA MARGARITA CORTEZ / ANTES ESCUELA ""CENTRO AMÉRICA"""
8;ESMERALDAS;0;;560;ESMERALDAS;5210;5 DE AGOSTO;U;1;5 DE AGOSTO;3446;"ESCUELA GENERAL BÁSICA ""DR. JOSE MARÍA VELASCO IBARRA"""
8;ESMERALDAS;0;;560;ESMERALDAS;5210;5 DE AGOSTO;U;1;5 DE AGOSTO;6070;ESCUELA EGB JULIO ESTUPIÑAN TELLO
8;ESMERALDAS;0;;560;ESMERALDAS;5210;5 DE AGOSTO;U;1;5 DE AGOSTO;6069;COLEGIO EGB JULIO ESTUPIÑAN TELLO
8;ESMERALDAS;0;;560;ESMERALDAS;5210;5 DE AGOSTO;U;1;5 DE AGOSTO;6023;ESCUELA EGB SAN JOSE OBRERO
8;ESMERALDAS;0;;560;ESMERALDAS;5210;5 DE AGOSTO;U;1;5 DE AGOSTO;6120;ESCUELA EGB ESMERALDAS LIBRE
8;ESMERALDAS;0;;560;ESMERALDAS;5210;5 DE AGOSTO;U;1;5 DE AGOSTO;6099;COLEGIO ESMERALDAS LIBRE
8;ESMERALDAS;0;;560;ESMERALDAS;5210;5 DE AGOSTO;U;2;PROPICIA 1;3330;"UNIDAD EDUCATIVA ""5 DE AGOSTO"""
8;ESMERALDAS;0;;560;ESMERALDAS;5210;5 DE AGOSTO;U;3;PROPICIA 4;3324;INSTITUTO TÉCNICO SUPERIOR LUIS TELLO
8;ESMERALDAS;0;;560;ESMERALDAS;5210;5 DE AGOSTO;U;89;VOTO EN CASA;0;
8;ESMERALDAS;0;;560;ESMERALDAS;5335;ESMERALDAS;U;1;ESMERALDAS;1920;"UNIDAD EDUCATIVA ""21 DE SEPTIEMBRE"""
8;ESMERALDAS;0;;560;ESMERALDAS;5335;ESMERALDAS;U;1;ESMERALDAS;1099;"ESCUELA GENERAL BÁSICA ""HISPANO AMERICA NRO. 2"""
8;ESMERALDAS;0;;560;ESMERALDAS;5335;ESMERALDAS;U;1;ESMERALDAS;1135;"COLEGIO DE BACHILLERATO FISCOMISIONAL ""SAGRADO CORAZÓN"""
8;ESMERALDAS;0;;560;ESMERALDAS;5335;ESMERALDAS;U;1;ESMERALDAS;1967;UNIDAD EDUCATIVA FISCOMISIONAL DON BOSCO/ANTES INSTITUTO PEDAGOGICO DON BOSCO
8;ESMERALDAS;0;;560;ESMERALDAS;5335;ESMERALDAS;U;1;ESMERALDAS;1968;ESCUELA GENERAL BASICA FISCOMISIONAL DON BOSCO
8;ESMERALDAS;0;;560;ESMERALDAS;5335;ESMERALDAS;U;1;ESMERALDAS;5458;UNIDAD EDUCATIVA ELOY ALFARO / ANTES COLEGIO BELLAS ARTES
8;ESMERALDAS;0;;560;ESMERALDAS;5335;ESMERALDAS;U;1;ESMERALDAS;1294;UNIDAD EDUCATIVA FISCAL ELOY ALFARO
8;ESMERALDAS;0;;560;ESMERALDAS;5335;ESMERALDAS;U;1;ESMERALDAS;1639;"ESCUELA GENERAL BASICA ""JUAN MONTALVO"""
8;ESMERALDAS;0;;560;ESMERALDAS;5335;ESMERALDAS;U;1;ESMERALDAS;1660;UNIDAD EDUCATIVA PARTICULAR LUZ Y LIBERTAD
8;ESMERALDAS;0;;560;ESMERALDAS;5335;ESMERALDAS;U;1;ESMERALDAS;6071;ESCUELA ROBERTO LUIS CERVANTES MONTAÑO
8;ESMERALDAS;0;;560;ESMERALDAS;5335;ESMERALDAS;U;1;ESMERALDAS;6072;COLEGIO ROBERTO LUIS CERVANTES MONTAÑO
8;ESMERALDAS;0;;560;ESMERALDAS;5335;ESMERALDAS;U;1;ESMERALDAS;6114;COLEGIO DE BACHILLERATO NOCTURNO ESMERALDAS
8;ESMERALDAS;0;;560;ESMERALDAS;5335;ESMERALDAS;U;1;ESMERALDAS;6117;UNIDAD EDUCATIVA MONSEÑOR LEONIDAS PROAÑO
8;ESMERALDAS;0;;560;ESMERALDAS;5335;ESMERALDAS;U;1;ESMERALDAS;6163;PONTIFICIA UNIVERSIDAD CATOLICA DEL ECUADOR SEDE ESMERALDAS
8;ESMERALDAS;0;;560;ESMERALDAS;5335;ESMERALDAS;U;2;ISLA LUIS VARGAS TORRES;4990;ESCUELA LEONIDAS GRUEZO GEORGE
8;ESMERALDAS;0;;560;ESMERALDAS;5335;ESMERALDAS;U;89;VOTO EN CASA;0;
8;ESMERALDAS;0;;560;ESMERALDAS;5600;LUIS TELLO / LAS PALMAS /;U;0;;1229;"ESCUELA GENERAL BASICA FISCAL ""GUAYAQUIL"""
8;ESMERALDAS;0;;560;ESMERALDAS;5600;LUIS TELLO / LAS PALMAS /;U;0;;1246;"UNIDAD EDUCATIVA FISCOMISIONAL ""NUEVO ECUADOR"""
8;ESMERALDAS;0;;560;ESMERALDAS;5600;LUIS TELLO / LAS PALMAS /;U;0;;3359;"ESCUELA GENERAL BÁSICA ""DR. RICARDO PAREDES"" / ANTES ESCUELA ECUADOR PAIS AMAZÓNICO"
8;ESMERALDAS;0;;560;ESMERALDAS;5600;LUIS TELLO / LAS PALMAS /;U;0;;6067;ESCUELA EGB MODESTO ELIAS MENDOZA MOREIRA
8;ESMERALDAS;0;;560;ESMERALDAS;6905;SIMON PLATA TORRES;U;1;SIMON PLATA TORRES;1915;"ESCUELA GENERAL BASICA ""NUESTRA SEÑORA DE LORETO"""
8;ESMERALDAS;0;;560;ESMERALDAS;6905;SIMON PLATA TORRES;U;1;SIMON PLATA TORRES;5457;UNIDAD EDUCATIVA ALFONSO QUIÑONEZ GEORGE
8;ESMERALDAS;0;;560;ESMERALDAS;6905;SIMON PLATA TORRES;U;2;VALLE DE SAN RAFAEL;1910;ESCUELA GENERAL BASICA CONSUELO BENAVIDES CEVALLOS
8;ESMERALDAS;0;;560;ESMERALDAS;6905;SIMON PLATA TORRES;U;2;VALLE DE SAN RAFAEL;6119;ESCUELA HOMERO LOPEZ SAUD
8;ESMERALDAS;0;;560;ESMERALDAS;6905;SIMON PLATA TORRES;U;3;CASA BONITA;3270;"UNIDA EDUCATIVA FISCOMISIONAL ""SAN DANIEL COMBONI"""
8;ESMERALDAS;0;;560;ESMERALDAS;6905;SIMON PLATA TORRES;U;4;LA TOLITA;3448;UNIDAD EDUCATIVA FISCOMISIONAL MARÍA AUXILIADORA
8;ESMERALDAS;0;;561;RIO VERDE;930;CHONTADURO;R;1;CHONTADURO;1674;UNIDAD EDUCATIVA FISCAL CHONTADURO
8;ESMERALDAS;0;;561;RIO VERDE;930;CHONTADURO;R;2; PARTIDERO;5905;UNIDAD EDUCATIVA EUGENIO CHUZING ALDAZ
8;ESMERALDAS;0;;561;RIO VERDE;965;CHUMUNDE;R;1;CHUMUNDE;3286;UNIDAD EDUCATIVA ARMENGOL LARA VALENCIA
8;ESMERALDAS;0;;561;RIO VERDE;965;CHUMUNDE;R;2;CAPULÍ;3902;ESCUELA DE EDUCACION BASICA ANTONIO ELIZALDE
8;ESMERALDAS;0;;561;RIO VERDE;965;CHUMUNDE;R;3;MARIBÉ;3901;ESCUELA RICARDO PLAZA BASTIDAS
8;ESMERALDAS;0;;561;RIO VERDE;965;CHUMUNDE;R;4;RASCADERA;5928;ESCUELA 7 DE JULIO
8;ESMERALDAS;0;;561;RIO VERDE;965;CHUMUNDE;R;5;PERLA ESMERALDEÑA/SAN RUFINO;5927;ESCUELA SAN RUFINO
8;ESMERALDAS;0;;561;RIO VERDE;2035;LAGARTO;R;1;LAGARTO;1666;UNIDAD EDUCATIVA FISCAL AURELIA BECERRA DE QUIÑONEZ / ANTES ESC. DE EDUCACIÓN BÁSICA QUISQUIS
8;ESMERALDAS;0;;561;RIO VERDE;2035;LAGARTO;R;1;LAGARTO;6181;UNIDAD EDUCATIVA AURELIA BECERRA DE QUIÑONEZ BLOQUE 2
8;ESMERALDAS;0;;561;RIO VERDE;2035;LAGARTO;R;2;BOCANA DEL LAGARTO;3262;ESCUELA DE EDUCACIÓN GENERAL BÁSICA DONATO YANUZELLY ORTÍZ
8;ESMERALDAS;0;;561;RIO VERDE;2035;LAGARTO;R;3;VAINILLA;3261;ESCUELA DE EDUCACIÓN BÁSICA SEBASTIÁN DE ILLESCAS
8;ESMERALDAS;0;;561;RIO VERDE;2445;MONTALVO / HORQUETA;R;0;;1687;UNIDAD EDUCATIVA JUAN MONTALVO
8;ESMERALDAS;0;;561;RIO VERDE;2445;MONTALVO / HORQUETA;R;0;;6136;COLISEO DE LA PARROQUIA MONTALVO
8;ESMERALDAS;0;;561;RIO VERDE;3215;ROCAFUERTE;R;1;ROCAFUERTE;1684;UNIDAD EDUCATIVA FISCAL RAMÓN ESTUPIÑAN
8;ESMERALDAS;0;;561;RIO VERDE;3215;ROCAFUERTE;R;1;ROCAFUERTE;6180;UNIDAD EDUCATIVA FISCAL RAMON ESTUPIÑAN BLOQUE 1
8;ESMERALDAS;0;;561;RIO VERDE;3215;ROCAFUERTE;R;2;CHUNGUILLO;3258;ESCUELA GENERAL BÁSICA FISCAL COTOPAXI
8;ESMERALDAS;0;;561;RIO VERDE;6720;RIO VERDE;U;1;RIO VERDE;1664;UNIDAD EDUCATIVA RIO VERDE / ANTES ESC. 24 DE MAYO
8;ESMERALDAS;0;;561;RIO VERDE;6720;RIO VERDE;U;1;RIO VERDE;6135;UNIDAD EDUCATIVA RIO VERDE
8;ESMERALDAS;0;;561;RIO VERDE;6720;RIO VERDE;U;2;CABUYAL;3284;CASA COMUNAL CABUYAL / ANTES ESCUELA RAMONA ORTIZ ESPINOZA
8;ESMERALDAS;0;;565;ELOY ALFARO;120;ANCHAYACU;R;0;;3308;UNIDAD EDUCATIVA FISCAL 2 DE AGOSTO
8;ESMERALDAS;0;;565;ELOY ALFARO;200;ATAHUALPA/CAMARONES;R;1;ATAHUALPA/CAMARONES;4140;PLAZOLETA
8;ESMERALDAS;0;;565;ELOY ALFARO;200;ATAHUALPA/CAMARONES;R;2;JUAN MONTALVO;3441;ESCUELA PUERTO BAQUERIZO
8;ESMERALDAS;0;;565;ELOY ALFARO;370;BORBON;R;0;;2017;UNIDAD EDUCATIVA FISCAL BORBON
8;ESMERALDAS;0;;565;ELOY ALFARO;370;BORBON;R;0;;2016;UNIDAD EDUCATIVA FISCOMISIONAL SANTA MARÍA GORETTI
8;ESMERALDAS;0;;565;ELOY ALFARO;1505;SAN JOSE DE CAYAPAS;R;1;SAN JOSE DE CAYAPAS;4156;"ESCUELA GENERAL BÁSICA ""RUMIÑAHUI"""
8;ESMERALDAS;0;;565;ELOY ALFARO;1505;SAN JOSE DE CAYAPAS;R;2;PICHIYACU CHACHI;4175;"UNIDAD EDUCATIVA ""HERCILIO PIANCHICHE OREJUELA"""
8;ESMERALDAS;0;;565;ELOY ALFARO;1505;SAN JOSE DE CAYAPAS;R;3;PLAYA GRANDE;5154;UNIDAD EDUCATIVA JOSE RICARDO MARTINEZ COBO
8;ESMERALDAS;0;;565;ELOY ALFARO;1505;SAN JOSE DE CAYAPAS;R;4;HERRADURA;5155;ESCUELA GENERAL BASICA RAFAEL MARIA ARIZA
8;ESMERALDAS;0;;565;ELOY ALFARO;1510;COLON ELOY DE MARIA;R;0;;3331;UNIDAD EDUCATIVA RAFAEL ASTUDILLO
8;ESMERALDAS;0;;565;ELOY ALFARO;1515;TIMBIRE;R;0;;3335;UNIDAD EDUCATIVA GONZALEZ S. CORDOVA
8;ESMERALDAS;0;;565;ELOY ALFARO;2125;LA TOLA;R;1;LA TOLA;1102;UNIDAD EDUCATIVA LA TOLA
8;ESMERALDAS;0;;565;ELOY ALFARO;2125;LA TOLA;R;2;SAN PEDRO;3312;ESCUELA FISCAL 17 DE DICIEMBRE
8;ESMERALDAS;0;;565;ELOY ALFARO;2225;LUIS VARGAS TORRES;R;0;;4147;UNIDAD EDUCATIVA RITA LECUMBERRY
8;ESMERALDAS;0;;565;ELOY ALFARO;2335;MALDONADO;R;0;;3271;UNIDAD EDUVATIVA FISCAL PEDRO VICENTE MALDONADO
8;ESMERALDAS;0;;565;ELOY ALFARO;2670;PAMPANAL DE BOLIVAR;R;0;;4148;ESCUELA DE EDUCACIÓN GENERAL BÁSICA MANUEL J. CALLE
8;ESMERALDAS;0;;565;ELOY ALFARO;3405;SAN FRANCISCO DE ONZOLE;R;1;SAN FRANCISCO DE ONZOLE;4149;"UNIDAD EDUCATIVA FISCAL ""SAN FRANCISCO DE ONZOLE"""
8;ESMERALDAS;0;;565;ELOY ALFARO;3405;SAN FRANCISCO DE ONZOLE;R;2;ZANCUDO;3345;ESCUELA DE EDUCACION GENERAL BASICA AGUSTIN BEDON
8;ESMERALDAS;0;;565;ELOY ALFARO;3805;SELVA ALEGRE;R;1;SELVA ALEGRE;3272;UNIDAD EDUCATIVA DOMINGO MEDINA ZURITA
8;ESMERALDAS;0;;565;ELOY ALFARO;3805;SELVA ALEGRE;R;2;PALMA REAL;3443;ESCUELA FISCAL PAULINA PERALTA
8;ESMERALDAS;0;;565;ELOY ALFARO;4170;TELEMBI;R;1;TELEMBI;4198;"ESCUELA GENERAL BÁSICA ""LEOPOLDO N. CHAVEZ"""
8;ESMERALDAS;0;;565;ELOY ALFARO;4170;TELEMBI;R;2;LOMA LINDA;4200;UNIDAD EDUCATIVA CECIB ATALAYA
8;ESMERALDAS;0;;565;ELOY ALFARO;4170;TELEMBI;R;3;CORRIENTE GRANDE;4204;"CENTRO EDUCATIVO COMUNITARIO INTERCULTURAL BILINGUE ""JOSÉ ZAPATA"""
8;ESMERALDAS;0;;565;ELOY ALFARO;4170;TELEMBI;R;4;JEYAMBI;4206;ESCUELA INTERCULTURAL RÍO ZAPALLO
8;ESMERALDAS;0;;565;ELOY ALFARO;4170;TELEMBI;R;5;GUALPI DEL CAYAPAS;4645;"ESCUELA GENERAL BÁSICA ""TEEKALI"""
8;ESMERALDAS;0;;565;ELOY ALFARO;4465;SANTO DOMINGO DE ONZOLE;R;1;SANTO DOMINGO DE ONZOLE;4180;"ESCUELA GENERAL BÁSICA ""GASTÓN FIGUEROA"""
8;ESMERALDAS;0;;565;ELOY ALFARO;4465;SANTO DOMINGO DE ONZOLE;R;2;COLON DE ONZOLE;4185;UNIDAD EDUCATIVA GRAN COLOMBIA
8;ESMERALDAS;0;;565;ELOY ALFARO;4465;SANTO DOMINGO DE ONZOLE;R;3;CHACHI CAPULÍ;4194;"CENTRO EDUCATIVO COMUNITARIO ""GONZALO PIZARRO"""
8;ESMERALDAS;0;;565;ELOY ALFARO;4465;SANTO DOMINGO DE ONZOLE;R;4;CHACHI GUALPÍ DE ONZOLE;4207;ESCUELA ROSENDO ORTIZ
8;ESMERALDAS;0;;565;ELOY ALFARO;4465;SANTO DOMINGO DE ONZOLE;R;5;HOJAS BLANCAS;3979;ESCUELA ABDON CALDERON MUÑOZ
8;ESMERALDAS;0;;565;ELOY ALFARO;4465;SANTO DOMINGO DE ONZOLE;R;6;HOJAS BLANCAS CHACHI;4000;UNIDAD EDUCATIVA JIBA JAKI
8;ESMERALDAS;0;;565;ELOY ALFARO;4595;SANTA LUCIA DE LAS PEÑAS;R;0;;3310;UNIDAD EDUCATIVA CONCEPCION TEMBORY FE Y ALEGRIA
8;ESMERALDAS;0;;565;ELOY ALFARO;6205;VALDEZ/LIMONES/;U;0;;702;UNIDAD EDUCATIVA CATOLICA FISCOMISIONAL PAULO VI
8;ESMERALDAS;0;;565;ELOY ALFARO;6205;VALDEZ/LIMONES/;U;0;;4170;UNIDAD EDUCATIVA 16 DE OCTUBRE/ANTES ESCUELA MANUELA CAÑIZARES
8;ESMERALDAS;0;;565;ELOY ALFARO;6205;VALDEZ/LIMONES/;U;0;;1966;UNIDAD EDUCATIVA 16 DE OCTUBRE/ANTES ESCUELA SIMON BOLIVAR Nro. 26
8;ESMERALDAS;0;;570;MUISNE;355;BOLIVAR;R;1;BOLIVAR;3285;UNIDAD EDUCATIVA JOSE JOAQUIN DE OLMEDO
8;ESMERALDAS;0;;570;MUISNE;355;BOLIVAR;R;2;MOMPICHE;3283;"ESCUELA GENERAL BÁSICA ""MAXIMINO INTRIAGO PATIÑO"""
8;ESMERALDAS;0;;570;MUISNE;1010;DAULE;R;1;DAULE;3287;ESCUELA GENERAL BÁSICA LUIS FELIPE BORJA
8;ESMERALDAS;0;;570;MUISNE;1010;DAULE;R;2;PEDRO CARBO;4026;ESCUELA EDUCACION GENERAL BASICA ALBERTO PERDOMO FRANCO
8;ESMERALDAS;0;;570;MUISNE;1305;GALERA;R;1;GALERA;3295;"ESCUELA GENERAL BÁSICA ""GENERAL VILLAMIL"""
8;ESMERALDAS;0;;570;MUISNE;1305;GALERA;R;2;ESTERO DE PLATANO;3872;"ESCUELA GENERAL BÁSICA ""VIÑA DEL MAR"""
8;ESMERALDAS;0;;570;MUISNE;3125;QUINGUE;R;0;;3875;ESCUELA REPUBLICA DE FRANCIA
8;ESMERALDAS;0;;570;MUISNE;3280;SALIMA;R;0;;4046;ESCUELA EDUCACION GENERAL BASICA MANABI
8;ESMERALDAS;0;;570;MUISNE;3390;SAN FRANCISCO;R;1;SAN FRANCISCO;3871;UNIDAD EDUCATIVA SAN FRANCISCO DEL CABO
8;ESMERALDAS;0;;570;MUISNE;3390;SAN FRANCISCO;R;2;EL SALTO;3873;"ESCUELA DE EDUCACIÓN GENERAL BÁSICA ""20 DE JULIO"""
8;ESMERALDAS;0;;570;MUISNE;3430;SAN GREGORIO;R;1;SAN GREGORIO;4045;ESCUELA EDUCACION BASICA PRESIDENTE ROSSVELT
8;ESMERALDAS;0;;570;MUISNE;3430;SAN GREGORIO;R;2;BALSALITO;4043;ESCUELA FISCAL MIXTA FILOCLEZ MUÑOZ
8;ESMERALDAS;0;;570;MUISNE;3430;SAN GREGORIO;R;3;BOCA DEL SUCIO;4044;ESCUELA EDUCACIÒN BASICA ATAHUALPA PERDOMO FRANCO
8;ESMERALDAS;0;;570;MUISNE;3430;SAN GREGORIO;R;4;TRES VIAS;3874;UNIDAD EDUCATIVA GABRIEL IRIARTE RÍOS
8;ESMERALDAS;0;;570;MUISNE;3430;SAN GREGORIO;R;5;SAN SALVADOR CHACHI;4060;"UNIDAD EDUCATIVA BILINGUE ""JUAN LORENZO AÑAPA"""
8;ESMERALDAS;0;;570;MUISNE;3470;SAN JOSE DE CHAMANGA;R;0;;1697;"UNIDAD EDUCATIVA ""CHAMANGA"""
8;ESMERALDAS;0;;570;MUISNE;5670;MUISNE;U;1;MUISNE;4461;"UNIDAD EDUCATIVA ""MUISNE"""
8;ESMERALDAS;0;;570;MUISNE;5670;MUISNE;U;1;MUISNE;5800;UNIDAD EDUCATIVA FISCOMISIONAL SAN LUIS GONZAGA
8;ESMERALDAS;0;;570;MUISNE;5670;MUISNE;U;1;MUISNE;5929;UNIDAD EDUCATIVA VICENTE ROCAFUERTE
8;ESMERALDAS;0;;570;MUISNE;5670;MUISNE;U;1;MUISNE;5930;ESCUELA HELLEN KALLER
8;ESMERALDAS;0;;570;MUISNE;5670;MUISNE;U;3;NUEVO MUISNE;3293;UNIDAD EDUCATIVA MUISNE / ANTES E.G.B. ESTANISLAO REYNA TREJO
8;ESMERALDAS;0;;570;MUISNE;5670;MUISNE;U;4;SAN PEDRO DE BILSA;5796;UNIDAD EDUCATIVA VICENTE TOBAR JARRIN
8;ESMERALDAS;0;;575;QUININDE;700;CUBE / CHANCAMA;R;1;CUBE / CHANCAMA;1399;UNIDAD EDUCATIVA REPUBLICA DE CUBA
8;ESMERALDAS;0;;575;QUININDE;700;CUBE / CHANCAMA;R;2;CHUCAPLE;4999;UNIDAD EDUCATIVA ARMADA NACIONAL
8;ESMERALDAS;0;;575;QUININDE;980;CHURA;R;0;;3870;ESCUELA DE ESDUCACIÓN GENERAL BÁSICA ANGELO PATRY
8;ESMERALDAS;0;;575;QUININDE;1530;LA UNION;R;1;LA UNION;634;ESCUELA GENERAL BASICA JHON F. KENEDDY
8;ESMERALDAS;0;;575;QUININDE;1530;LA UNION;R;1;LA UNION;5456;UNIDAD EDUCATIVA QUITO
8;ESMERALDAS;0;;575;QUININDE;1530;LA UNION;R;1;LA UNION;6202;UNIDAD EDUCATIVA LA UNION
8;ESMERALDAS;0;;575;QUININDE;1530;LA UNION;R;1;LA UNION;6000;UNIDAD EDUCATIVA FISCOMISIONAL CATOLICA SANTA MARIA DE NAZARET
8;ESMERALDAS;0;;575;QUININDE;1530;LA UNION;R;1;LA UNION;5975;UNIDAD EDUCATIVA NUESTRA SEÑORA DEL CISNE
8;ESMERALDAS;0;;575;QUININDE;1530;LA UNION;R;2;LA INDEPENDENCIA;3352;"ESCUELA DE EDUCACIÓN GENERAL BÁSICA ""CARLOS ANDRADE DE MARIN"""
8;ESMERALDAS;0;;575;QUININDE;1530;LA UNION;R;3;LIBERTAD DE PLAYA;3291;ESCUELA FISCAL MIXTA 15 DE AGOSTO
8;ESMERALDAS;0;;575;QUININDE;1530;LA UNION;R;4;BOCANA DEL BUA;3257;ESCUELA FISCAL MIXTA SOBERANIA ESMERALDEÑA
8;ESMERALDAS;0;;575;QUININDE;1530;LA UNION;R;6;LA ESMERALDA;3288;ESCUELA FISCAL MIXTA MIGUEL RIOFRIO
8;ESMERALDAS;0;;575;QUININDE;1530;LA UNION;R;7;MATAMBA;3259;ESCUELA FISCAL DR. CARLOS CUEVA TAMARIZ
8;ESMERALDAS;0;;575;QUININDE;1530;LA UNION;R;8;EL SILENCIO;3290;ESCUELA EDUCACIÓN GENERAL BÁSICA CIUDAD DE AMBATO
8;ESMERALDAS;0;;575;QUININDE;1530;LA UNION;R;9;NUEVO AZUAY;3292;ESCUELA GENERAL BÁSICA NUEVO AZUAY
8;ESMERALDAS;0;;575;QUININDE;1530;LA UNION;R;10;LA VIRGENCITA;3260;ESCUELA FISCAL MIXTA CORONEL RAMON VALDEZ CERVANTES
8;ESMERALDAS;0;;575;QUININDE;1530;LA UNION;R;11;EL BELEN;4989;ESCUELA DE EDUCACION GENERAL BASICA FISCAL CORNELIO MERIZALDE
