COD_PROVINCIA;NOM_PROVINCIA;COD_CIRCUNSCRIPCION;NOM_CIRCUNSCRIPCION;COD_CANTON;NOM_CANTON;COD_PARROQUIA;NOM_PARROQUIA;EST_PARROQUIA;COD_ZONA;NOM_ZONA;COD_RECINTO;NOM_RECINTO
11;LOJA;0;;310;PALTAS;545;SAN ANTONIO;R;0;;2561;UNIDAD EDUCATIVA DR. CARLOS MANUEL ESPINOZA ESPINOZA - YA NO ES ESCUELA JOSE MALDONADO HURTADO
11;LOJA;0;;310;PALTAS;995;CASANGA;R;0;;2589;UNIDAD EDUCATIVA MANUEL JOSE JARAMILLO
11;LOJA;0;;310;PALTAS;1000;YAMANA;R;0;;2593;ESCUELA BERMEO VASQUEZ
11;LOJA;0;;310;PALTAS;1380;GUACHANAMA;R;1;GUACHANAMA;2565;UNIDAD EDUCATIVA 29 DE MAYO
11;LOJA;0;;310;PALTAS;1380;GUACHANAMA;R;2;BRAMADEROS;2590;UNIDAD EDUCATIVA LAURO GUERRERO BECERRA
11;LOJA;0;;310;PALTAS;1380;GUACHANAMA;R;3;EL DULCE;2554;ESCUELA DE EDUCACION BASICA BRAULIO BARILLAS
11;LOJA;0;;310;PALTAS;1380;GUACHANAMA;R;4;EL LIMON;5255;Escuela de Educación Básica Parcialidad de Paltas
11;LOJA;0;;310;PALTAS;2140;LAURO GUERRERO;R;1;LAURO GUERRERO;2551;UNIDAD EDUCATIVA LAURO GUERRERO
11;LOJA;0;;310;PALTAS;2140;LAURO GUERRERO;R;2;LA PALMA;3164;ESCUELA ANDRES F. CORDOVA
11;LOJA;0;;310;PALTAS;2630;ORIANGA;R;1;ORIANGA;2608;UNIDAD EDUCATIVA ORIANGA
11;LOJA;0;;310;PALTAS;2630;ORIANGA;R;2;NARANJILLO;2858;ESCUELA SANTOS EFRAIN ELIZALDE
11;LOJA;0;;310;PALTAS;5180;CATACOCHA;U;0;;1327;UNIDAD EDUCATIVA MARISTA - ESCUELA
11;LOJA;0;;310;PALTAS;5180;CATACOCHA;U;0;;1361;ESCUELA 3 DE DICIEMBRE
11;LOJA;0;;310;PALTAS;5180;CATACOCHA;U;0;;1304;UNIDAD EDUCATIVA DOMINGO CELI
11;LOJA;0;;310;PALTAS;5180;CATACOCHA;U;0;;6092;UNIDAD EDUCATIVA PALTAS
11;LOJA;0;;310;PALTAS;5595;LOURDES;U;1;LOURDES;2548;UNIDAD EDUCATIVA FISCOMISIONAL MARISTA DE CATACOCHA
11;LOJA;0;;310;PALTAS;5595;LOURDES;U;2;LAS COCHAS;2564;MONSEÑOR FRANCISCO VALDIVIESO
11;LOJA;0;;310;PALTAS;5595;LOURDES;U;3;SAN VICENTE DEL RIO;2534;COLEGIO SEGUNDO CUEVA CELI
11;LOJA;0;;311;OLMEDO;2120;LA TINGUE;R;0;;2932;ESCUELA ANTONIO NARIÑO
11;LOJA;0;;311;OLMEDO;6730;OLMEDO;U;0;;1203;UNIDAD EDUCATIVA MONSEÑOR ALBERTO ZAMBRANO PALACIOS
11;LOJA;0;;311;OLMEDO;6730;OLMEDO;U;0;;6095;UNIDAD EDUCATIVA CRISTOBAL COLON
11;LOJA;0;;315;CELICA;695;CRUZPAMBA/BUSTAMANTE;R;0;;2540;CARLOS BUSTAMANTE
11;LOJA;0;;315;CELICA;1495;TNTE M.RODRIGUEZ LOAYZA;R;0;;2541;ESCUELA DE EDUCACIÓN BÁSICA ALFREDO ROBERS
11;LOJA;0;;315;CELICA;3255;SABANILLA;R;1;SABANILLA;2542;MANUEL MARÍA SÁNCHEZ
11;LOJA;0;;315;CELICA;3255;SABANILLA;R;2;HIGUERON;2456;ESCUELA DE EDUCACION BASICA TERESA CEPEDA Y FUENTES
11;LOJA;0;;315;CELICA;3255;SABANILLA;R;3;POTRERILLOS - VICIN;4673;ESCUELA LAZARO CARDENAS
11;LOJA;0;;315;CELICA;3535;SAN JUAN DE POZUL;R;1;SAN JUAN DE POZUL;5568;COLEGIO AGROPECUARIO TNTE. MAXIMILIANO RODRÍGUEZ
11;LOJA;0;;315;CELICA;3535;SAN JUAN DE POZUL;R;2;POTRERILLOS;2543;JOSÉ JAVIER EGUIGUREN
11;LOJA;0;;315;CELICA;5195;CELICA;U;0;;1078;UNIDAD EDUCATIVA SANTA TERESITA
11;LOJA;0;;315;CELICA;5195;CELICA;U;0;;1183;DISTRITO DE EDUCACIÓN CELICA, PUYANGO Y PINDAL / EXCOLEGIO DE BACHILLERATO 12 DE DICIEMBRE
11;LOJA;0;;320;CALVAS;590;COLAIZACA;R;1;COLAIZACA;2994;UNIDAD EDUCATIVA EDMUNDO CEVALLOS
11;LOJA;0;;320;CALVAS;590;COLAIZACA;R;2;CHINCHANGA CENTRO;3000;UNIDAD EDUCATIVA HIPÓLITO AMADO LOAIZA
11;LOJA;0;;320;CALVAS;1230;EL LUCERO;R;0;;1564;ESCUELA DE EDUCACION BASICA CARLOS MONTUFAR
11;LOJA;0;;320;CALVAS;1550;SANGUILLIN;R;0;;2984;UNIDAD EDUCATIVA SANGUILLIN
11;LOJA;0;;320;CALVAS;4150;UTUANA;R;0;;2957;RED EDUCATIVA UTUANA
11;LOJA;0;;320;CALVAS;5175;CARIAMANGA;U;0;;1556;UNIDAD EDUCATIVA FISCOMISIONAL SANTIAGO FERNADEZ GARGIA
11;LOJA;0;;320;CALVAS;5175;CARIAMANGA;U;0;;3011;UNIDAD EDUCATIVA MARÍA AUXILIADORA
11;LOJA;0;;320;CALVAS;5175;CARIAMANGA;U;0;;6083;UNIDAD EDUCATIVA CARIAMANGA
11;LOJA;0;;320;CALVAS;5175;CARIAMANGA;U;0;;1535;UNIDAD EDUCATIVA FISCOMISIONAL SANTA JUANA DE ARCO LA SALLE
11;LOJA;0;;320;CALVAS;5175;CARIAMANGA;U;0;;1515;UNIDAD EDUCATIVA ELOY ALFARO
11;LOJA;0;;320;CALVAS;5240;CHILE;U;0;;1544;ESCUELA DE EDUCACION BASICA CHILE
11;LOJA;0;;320;CALVAS;5240;CHILE;U;0;;6084;UNIDAD EDUCATIVA AMBATO
11;LOJA;0;;320;CALVAS;6025;SAN VICENTE;U;0;;3013;UNIDAD EDUCATIVA ELOY ALFARO EDUCACIÓN BÁSICA PORTOVIEJO
11;LOJA;0;;325;MACARA;2085;LA RAMA;R;0;;2362;CANCHA DE USO MÚLTIPLE
11;LOJA;0;;325;MACARA;2145;LA VICTORIA;R;0;;2586;ESCUELA DE EDUCACIÓN BÁSICA TORIBIO MORA
11;LOJA;0;;325;MACARA;3265;SABIANGO;R;0;;2566;UNIDAD EDUCATIVA REVERENDO JORGE SANCHEZ MORENO
11;LOJA;0;;325;MACARA;5385;GRAL.ELOY ALFARO;U;0;;2360;ESCUELA DE EDUCACION BASICA JHON F KENNEDY
11;LOJA;0;;325;MACARA;5680;MACARA;U;1;MACARA;1075;UNIDAD EDUCATIVA MARISTA MACARA
11;LOJA;0;;325;MACARA;5680;MACARA;U;1;MACARA;1074;UNIDAD EDUCATIVA FISCOMISIONAL SANTA MARIANA DE JESUS
11;LOJA;0;;325;MACARA;5680;MACARA;U;1;MACARA;6089;UNIDAD EDUCATIVA DEL MILENIO 5 DE JUNIO
11;LOJA;0;;325;MACARA;5680;MACARA;U;1;MACARA;6107;ESCUELA DE EDUCACION BASICA CIUDAD DE CUENCA
11;LOJA;0;;325;MACARA;5680;MACARA;U;2;ALGODONAL;2359;ESCUELA DE EDUCACIÓN BÁSICA CORONEL MIGUEL ÁNGEL ESTRELLA
11;LOJA;0;;330;PUYANGO;270;EL ARENAL;R;0;;2928;COLEGIO DE BACHILLERATO RAMON SAMANIEGO PALACIOS
11;LOJA;0;;330;PUYANGO;565;CIANO;R;1;CIANO;2926;ESCUELA SEGUNDO MIGUEL SALAZAR
11;LOJA;0;;330;PUYANGO;565;CIANO;R;2;LAS COCHAS;2895;ESCUELA FISCAL MIXTA MANUEL QUIROGA
11;LOJA;0;;330;PUYANGO;1155;EL LIMO /MARIANA DE JESUS;R;1;EL LIMO /MARIANA DE JESUS;2937;ESCUELA ANTONIO RICAURTE
11;LOJA;0;;330;PUYANGO;1155;EL LIMO /MARIANA DE JESUS;R;2;MANGURQUILLO;2935;ESCUELA DE EDUCACION BASICA JULIO ALBERTO PAREDES
11;LOJA;0;;330;PUYANGO;2405;MERCADILLO;R;0;;2929;ESCUELA DE EDUCACION BASICA ALONSO DE MERCADILLO
11;LOJA;0;;330;PUYANGO;4210;VICENTINO;R;1;VICENTINO;2893;COLEGIO DE BACHILLERATO MANUEL CARRION PINZANO
11;LOJA;0;;330;PUYANGO;4210;VICENTINO;R;2; GUATUNUMÁ;5851;ESCUELA DE EDUCACIÓN BÁSICA 8 DE SEPTIEMBRE
11;LOJA;0;;330;PUYANGO;5005;ALAMOR;U;0;;833;UNIDAD EDUCATIVA JULIO ISAAC ESPINOZA OCHOA / ANTIGUO ESCUELA ELOY ALFARO
11;LOJA;0;;330;PUYANGO;5005;ALAMOR;U;0;;788;COLEGIO DE BACHILLERATO PUYANGO / ANTIGUO COLEGIO TECNICO PUYANGO
11;LOJA;0;;330;PUYANGO;5005;ALAMOR;U;0;;2931;ESCUELA DE EDUCACION BASICA FISCOMISIONAL GRAN COLOMBIA
11;LOJA;0;;335;GONZANAMA;825;CHANGAIMINA /LA LIBERTAD;R;0;;1547;UNIDAD EDUCATIVA SAN VICENTE DE PAUL
11;LOJA;0;;335;GONZANAMA;2520;NAMBACOLA;R;0;;2114;UNIDAD EDUCATIVA NAMBACOLA BLOQUE 1
11;LOJA;0;;335;GONZANAMA;2520;NAMBACOLA;R;0;;2117;UNIDAD EDUCATIVA NAMBACOLA
11;LOJA;0;;335;GONZANAMA;3045;PURUNUMA /EGUIGUREN;R;0;;2432;UNIDAD EDUCATIVA PURUNUMA
11;LOJA;0;;335;GONZANAMA;3270;SACAPALCA;R;1;SACAPALCA;2119;UNIDAD EDUCATIVA JOSE FELIX DE VALDIVIESO
11;LOJA;0;;335;GONZANAMA;3270;SACAPALCA;R;2;CRUZ DE YAZAPA;2098;ESCUELA CIUDAD DE GONZANAMÀ
11;LOJA;0;;335;GONZANAMA;3270;SACAPALCA;R;3;LIMON VEGA;2126;ESCUELA CAMILO PONCE ENRIQUEZ
11;LOJA;0;;335;GONZANAMA;3270;SACAPALCA;R;4;VEGA GRANDE;2187;ESCUELA FISCAL MIXTA NEWTON
11;LOJA;0;;335;GONZANAMA;5400;GONZANAMA;U;0;;2425;UNIDAD EDUCATIVA GONZANAMA
11;LOJA;0;;335;GONZANAMA;5400;GONZANAMA;U;0;;2421;UNIDAD EDUCATIVA FISCOMISIONAL P. JORGE AVIATAR QUEVEDO
11;LOJA;0;;340;ESPINDOLA;320;BELLAVISTA;R;1;BELLAVISTA;2506;UNIDAD EDUCATIVA JOSE MARIA RIOFRIO
11;LOJA;0;;340;ESPINDOLA;320;BELLAVISTA;R;2;JIBIRUCHE;2509;UNIDAD EDUCATIVA CABO CASTILLO
11;LOJA;0;;340;ESPINDOLA;790;EL INGENIO;R;1;EL INGENIO;2503;ESCUELA JAVIER VALDIVIESO
11;LOJA;0;;340;ESPINDOLA;790;EL INGENIO;R;2;GRANADILLO;2501;ESCUELA ANA MARIETA ROJAS GARRIDO
11;LOJA;0;;340;ESPINDOLA;790;EL INGENIO;R;3;CONSAGUANA;5804;ESCUELA DE EDUCACIÓN BÁSICA NICOLAS MAQUIAVELO
11;LOJA;0;;340;ESPINDOLA;1645;EL AIRO;R;0;;2504;ESCUELA HERNANDO DE BARAHONA
11;LOJA;0;;340;ESPINDOLA;1845;JIMBURA;R;0;;2508;UNIDAD EDUCATIVA MONS. JULIO ERNESTO CELI
11;LOJA;0;;340;ESPINDOLA;3765;SANTA TERESITA;R;1;SANTA TERESITA;2516;ESCUELA DE EDUCACION BASICA RIOBAMBA
11;LOJA;0;;340;ESPINDOLA;3765;SANTA TERESITA;R;2;TUNDURAMA;2513;COLEGIO HUGO GUILLERMO GONZALEZ
11;LOJA;0;;340;ESPINDOLA;4460;27 DE ABRIL /LA NARANJA;R;0;;2498;ESCUELA AZOGUES
11;LOJA;0;;340;ESPINDOLA;5020;AMALUZA;U;0;;527;UNIDAD EDUCATIVA FISCOMISIONAL MONSEÑOR LUIS ALFONZO CRESPO
11;LOJA;0;;340;ESPINDOLA;5020;AMALUZA;U;0;;551;UNIDAD EDUCATIVA ROSA HERLINDA GARCIA DE GARCIA
11;LOJA;0;;345;SOZORANGA;2575;NUEVA FATIMA;R;0;;2894;ESCUELA DE EDUCACIÓN BÁSICA ESMERALDAS
11;LOJA;0;;345;SOZORANGA;3935;TACAMOROS;R;1;TACAMOROS;1049;UNIDAD EDUCATIVA DOCTOR ZOILO RODRÍGUEZ
11;LOJA;0;;345;SOZORANGA;3935;TACAMOROS;R;2;LA DELICIA;2888;COLEGIO DE BACHILLERATO DR. MANUEL AGUSTÍN AGUIRRE
11;LOJA;0;;345;SOZORANGA;3935;TACAMOROS;R;3;PANDUANA;2870;ESCUELA EDUCACIÓN BÁSICA EMILIANO ORTEGA ESPINOZA
11;LOJA;0;;345;SOZORANGA;6120;SOZORANGA;U;0;;1065;COLEGIO DE BACHILLERATO 18 DE NOVIEMBRE
11;LOJA;0;;345;SOZORANGA;6120;SOZORANGA;U;0;;2892;ESCUELA DE EDUCACION BASICA ZOILO RODRIGUEZ
11;LOJA;0;;730;PINDAL;835;CHAQUINAL;R;1;CHAQUINAL;2447;UNIDAD EDUCATIVA DOCTOR RAMÓN RIOFRÍO BUSTAMANTE
11;LOJA;0;;730;PINDAL;835;CHAQUINAL;R;2;EL PAPAYO;3060;ESUELA DE EDUCACION BASICA LUZ ANGÉLICA MARTINEZ
11;LOJA;0;;730;PINDAL;1035;12 DE DICIEMBRE;R;1;12 DE DICIEMBRE;2536;ESCUELA DE EDUCACION BASICA JUAN PIO MONTUFAR
11;LOJA;0;;730;PINDAL;1035;12 DE DICIEMBRE;R;2;CURIACHI;3047;ESCUELA DOLORES SUCRE
11;LOJA;0;;730;PINDAL;4545;MILAGROS;R;1;MILAGROS;2537;EDUARDO DE EDUCACION BASICA EDUARDO HANNER
11;LOJA;0;;730;PINDAL;4545;MILAGROS;R;2;EL GUANDO;3065;ESCUELA DE EDUCACION BASICA JOSE RODRIGUEZ DE LA BANDERA
11;LOJA;0;;730;PINDAL;5810;PINDAL /FEDERICO PAEZ;U;0;;2538;COLEGIO NACIONAL PINDAL
11;LOJA;0;;730;PINDAL;5810;PINDAL /FEDERICO PAEZ;U;0;;969;ESCUELA DE EDUCACION BASICA LUIS URDANETA
11;LOJA;0;;740;QUILANGA;360;FUNDOCHAMBA;R;0;;2176;ESCUELA DE EDUCACIÓN BÁSICA LUIS ALBERTO SOTOMAYOR
11;LOJA;0;;740;QUILANGA;3345;SAN ANTONIO DE LAS ARADAS;R;0;;2150;UNIDAD EDUCATIVA MIGUEL ANTORIANO SALINAS JARAMILLO
11;LOJA;0;;740;QUILANGA;6260;QUILANGA /LA PAZ;U;0;;392;UNIDAD EDUCATIVA QUILANGA
11;LOJA;0;;740;QUILANGA;6260;QUILANGA /LA PAZ;U;0;;2175;UNIDAD EDUCATIVA QUILANGA BLOQUE 1
11;LOJA;0;;815;CHAGUARPAMBA;385;BUENAVISTA;R;0;;2195;COLEGIO DE BACHILLERATO JUAN FRANCISCO ONTANEDA
11;LOJA;0;;815;CHAGUARPAMBA;1180;EL ROSARIO;R;0;;2210;CASA COMUNAL SALON SOCIAL EL ROSARIO
11;LOJA;0;;815;CHAGUARPAMBA;1450;AMARILLOS;R;0;;2243;ESCUELA DE EDUCACIÓN BÁSICA 12 DE FEBRERO
11;LOJA;0;;815;CHAGUARPAMBA;3755;SANTA RUFINA;R;1;SANTA RUFINA;2207;ESCUELA DE EDUCACION BASICA CONDORAZO
11;LOJA;0;;815;CHAGUARPAMBA;3755;SANTA RUFINA;R;2;LOZUMBE;2198;ESCUELA JULIO MOISES CORDOVA ROJAS
11;LOJA;0;;815;CHAGUARPAMBA;6530;CHAGUARPAMBA;U;0;;1303;COLEGIO TECNICO CHAGUARPAMBA
11;LOJA;0;;815;CHAGUARPAMBA;6530;CHAGUARPAMBA;U;0;;2223;ESCUELA DE EDUCACIÓN BÁSICA 5 DE JUNIO
12;LOS RIOS;0;;515;BABAHOYO;520;CARACOL;R;0;;376;UNIDAD EDUCATIVA CARACOL - BLOQUE JOSE JOAQUIN DE OLMEDO - BLOQUE 1
12;LOS RIOS;0;;515;BABAHOYO;520;CARACOL;R;0;;6328;UNIDAD EDUCATIVA CARACOL - BLOQUE CENTRAL
12;LOS RIOS;0;;515;BABAHOYO;1265;FEBRES CORDERO;R;1;FEBRES CORDERO;311;UNIDAD EDUCATIVA 29 DE AGOSTO
12;LOS RIOS;0;;515;BABAHOYO;1265;FEBRES CORDERO;R;1;FEBRES CORDERO;1994;ESCUELA DE EDUCACION BASICA ARMANDO PAREJA CORONEL
12;LOS RIOS;0;;515;BABAHOYO;1265;FEBRES CORDERO;R;1;FEBRES CORDERO;6178;POLIDEPORTIVO DE USO MULTIPLE DE MATA DE CACAO
12;LOS RIOS;0;;515;BABAHOYO;1265;FEBRES CORDERO;R;2;MATILDE ESTHER;3890;ESCUELA DE EDUCACION BASICA HORACIO IDROVO
12;LOS RIOS;0;;515;BABAHOYO;1265;FEBRES CORDERO;R;3;PUEBLO NUEVO;3888;UNIDAD EDUCATIVA PUEBLO NUEVO
12;LOS RIOS;0;;515;BABAHOYO;1525;LA UNION;R;1;LA UNION;4260;UNIDAD EDUCATIVA DEL MILENIO CARLOS ALBERTO AGUIRRE AVILES
12;LOS RIOS;0;;515;BABAHOYO;1525;LA UNION;R;1;LA UNION;321;UNIDAD EDUCATIVA ECUADOR
12;LOS RIOS;0;;515;BABAHOYO;1525;LA UNION;R;2;EL CUATRO;6193;ESCUELA DE EDUCACION BASICA SOFIA ALARCON DE ESPIN
12;LOS RIOS;0;;515;BABAHOYO;2875;PIMOCHA;R;1;PIMOCHA;4656;UNIDAD EDUCATIVA DEL MILENIO SIMON BOLIVAR
12;LOS RIOS;0;;515;BABAHOYO;2875;PIMOCHA;R;1;PIMOCHA;1940;ESCUELA DE EDUCACION BASICA SIMON BOLIVAR
12;LOS RIOS;0;;515;BABAHOYO;2875;PIMOCHA;R;2;ISABEL MARIA;3879;ESCUELA DE EDUCACION BASICA ISABEL MARIA DE PONCE
12;LOS RIOS;0;;515;BABAHOYO;2875;PIMOCHA;R;3;LA VIRGINIA;5365;CASA DE OLMEDO
12;LOS RIOS;0;;515;BABAHOYO;5215;CLEMENTE BAQUERIZO;U;1;CLEMENTE BAQUERIZO;65;UNIDAD EDUCATIVA PADRE MARCOS BENETAZZO
12;LOS RIOS;0;;515;BABAHOYO;5215;CLEMENTE BAQUERIZO;U;1;CLEMENTE BAQUERIZO;572;UNIDAD EDUCATIVA JOSE MARIA ESTRADA COELLO
12;LOS RIOS;0;;515;BABAHOYO;5215;CLEMENTE BAQUERIZO;U;1;CLEMENTE BAQUERIZO;319;UNIDAD EDUCATIVA EUGENIO ESPEJO
12;LOS RIOS;0;;515;BABAHOYO;5215;CLEMENTE BAQUERIZO;U;1;CLEMENTE BAQUERIZO;558;UNIDAD EDUCATIVA FRANCISCO HUERTA RENDON
12;LOS RIOS;0;;515;BABAHOYO;5215;CLEMENTE BAQUERIZO;U;1;CLEMENTE BAQUERIZO;2061;UNIVERSIDAD TECNICA DE BABAHOYO
12;LOS RIOS;0;;515;BABAHOYO;5215;CLEMENTE BAQUERIZO;U;1;CLEMENTE BAQUERIZO;2056;UNIDAD EDUCATIVA ANEXO UTB
12;LOS RIOS;0;;515;BABAHOYO;5215;CLEMENTE BAQUERIZO;U;1;CLEMENTE BAQUERIZO;6131;UNIDAD EDUCATIVA EMIGDIO ESPARZA MORENO - BLOQUE 1
12;LOS RIOS;0;;515;BABAHOYO;5215;CLEMENTE BAQUERIZO;U;1;CLEMENTE BAQUERIZO;6009;UNIDAD EDUCATIVA EMIGDIO ESPARZA MORENO - BLOQUE 2
12;LOS RIOS;0;;515;BABAHOYO;5215;CLEMENTE BAQUERIZO;U;2;PUERTA NEGRA;4998;UNIDAD EDUCATIVA REPLICA EUGENIO ESPEJO
12;LOS RIOS;0;;515;BABAHOYO;5215;CLEMENTE BAQUERIZO;U;89;VOTO EN CASA;0;
12;LOS RIOS;0;;515;BABAHOYO;5285;DR. CAMILO PONCE E.;U;0;;1867;UNIDAD EDUCATIVA BABAHOYO
12;LOS RIOS;0;;515;BABAHOYO;5285;DR. CAMILO PONCE E.;U;0;;1736;UNIDAD EDUCATIVA JUAN E. VERDEZOTO
12;LOS RIOS;0;;515;BABAHOYO;5285;DR. CAMILO PONCE E.;U;0;;944;ESCUELA DE EDUCACION BASICA AURORA ESTRADA
12;LOS RIOS;0;;515;BABAHOYO;5285;DR. CAMILO PONCE E.;U;0;;1706;ESCUELA DEL SINDICATO DE CHOFERES-LOS RIOS
12;LOS RIOS;0;;515;BABAHOYO;5285;DR. CAMILO PONCE E.;U;0;;6170;UNIDAD EDUCATIVA ADOLFO MARIA ASTUDILLO
12;LOS RIOS;0;;515;BABAHOYO;6830;BARREIRO /SANTA RITA;U;1;BARREIRO /SANTA RITA;1919;UNIDAD EDUCATIVA BARREIRO
12;LOS RIOS;0;;515;BABAHOYO;6830;BARREIRO /SANTA RITA;U;2; BARREIRO NUEVO;6192;UNIDAD EDUCATIVA ABDON CALDERON MUÑOZ
12;LOS RIOS;0;;515;BABAHOYO;6835;EL SALTO;U;0;;3927;UNIDAD EDUCATIVA DARIO C GUEVARA
12;LOS RIOS;0;;516;VALENCIA;6685;VALENCIA;U;1;VALENCIA;1990;UNIDAD EDUCATIVA CIUDAD DE VALENCIA
12;LOS RIOS;0;;516;VALENCIA;6685;VALENCIA;U;1;VALENCIA;1955;ESCUELA DE EDUCACION BASICA VICTOR MANUEL RENDON
12;LOS RIOS;0;;516;VALENCIA;6685;VALENCIA;U;1;VALENCIA;1874;ESCUELA DE EDUCACION BASICA GALO PLAZA LASSO
12;LOS RIOS;0;;516;VALENCIA;6685;VALENCIA;U;1;VALENCIA;6048;COLISEO COOPERATIVA 12 DE JULIO
12;LOS RIOS;0;;516;VALENCIA;6685;VALENCIA;U;1;VALENCIA;6047;COLISEO LUIS FELIPE DIAZ
12;LOS RIOS;0;;516;VALENCIA;6685;VALENCIA;U;2;EL VERGEL;1956;ESCUELA DE EDUCACION BASICA EL VERGEL
12;LOS RIOS;0;;516;VALENCIA;6685;VALENCIA;U;3;COSTA AZUL;3911;ESCUELA DE EDUCACION BASICA GIRON
12;LOS RIOS;0;;516;VALENCIA;6685;VALENCIA;U;4;FEDERICO INTRIAGO;3934;UNIDAD EDUCATIVA FEDERICO INTRIAGO
12;LOS RIOS;0;;516;VALENCIA;6685;VALENCIA;U;5;RIO CHILA;3913;ESCUELA DE EDUCACION BASICA JULIO TOBAR BAQUERO
12;LOS RIOS;0;;516;VALENCIA;6685;VALENCIA;U;6;COOPERATIVA 6 DE AGOSTO;3961;ESCUELA DE EDUCACION BASICA PACTO ANDINO
12;LOS RIOS;0;;516;VALENCIA;6685;VALENCIA;U;7;GONZALEZ SUAREZ;3938;EX. ESCUELA DE EDUCACION BASICA REPUBLICA DEL SALVADOR
12;LOS RIOS;0;;520;BABA;1460;GUARE;R;1;GUARE;1699;UNIDAD EDUCATIVA GUARE
12;LOS RIOS;0;;520;BABA;1460;GUARE;R;1;GUARE;1862;ESCUELA DE EDUCACION BASICA GENERAL VILLAMIL
12;LOS RIOS;0;;520;BABA;1460;GUARE;R;2;LA CARMELA;3942;"ESCUELA DE EDUCACION BASICA ""ZOILA UGARTE"""
12;LOS RIOS;0;;520;BABA;1460;GUARE;R;3;EL GUAYABO;3941;ESCUELA DE EDUCACION BASICA FRANCISCO CAMPOS COELLO
12;LOS RIOS;0;;520;BABA;1460;GUARE;R;4;CAMPO ALEGRE;3940;"ESCUELA DE EDUCACION BASICA"" VICTOR HUGO"""
12;LOS RIOS;0;;520;BABA;1740;ISLA DE BEJUCAL;R;0;;337;UNIDAD EDUCATIVA ISLA DE BEJUCAL
12;LOS RIOS;0;;520;BABA;1740;ISLA DE BEJUCAL;R;0;;4596;ESCUELA DE EDUCACION BASICA ANGEL VILLAMARIN ORTIZ
12;LOS RIOS;0;;520;BABA;5085;BABA;U;0;;1422;UNIDAD EDUCATIVA 23 DE JUNIO
12;LOS RIOS;0;;520;BABA;5085;BABA;U;0;;1700;ESCUELA DE EDUCACION BASICA MIGUEL DE CERVANTES
12;LOS RIOS;0;;520;BABA;5085;BABA;U;0;;1333;UNIDAD EDUCATIVA JUAN MONTALVO - BABA
12;LOS RIOS;0;;520;BABA;5085;BABA;U;0;;1750;COLISEO DE LIGA CANTONAL DE BABA
12;LOS RIOS;0;;520;BABA;5085;BABA;U;0;;6144;POLIDEPORTIVO MUNICIPAL DEL CANTON BABA
12;LOS RIOS;0;;525;VINCES;140;ANTONIO SOTOMAYOR;R;1;ANTONIO SOTOMAYOR;1995;UNIDAD EDUCATIVA 13 DE ENERO
12;LOS RIOS;0;;525;VINCES;140;ANTONIO SOTOMAYOR;R;2;BAGATELA;3947;"ESCUELA DE EDUCACIÓN BÁSICA ""AMADO VARGAS NIVELA"""
12;LOS RIOS;0;;525;VINCES;140;ANTONIO SOTOMAYOR;R;5;CLARIZA;3966;"UNIDAD EDUCATIVA ""FRANCISCO TERAN"""
12;LOS RIOS;0;;525;VINCES;6245;VINCES;U;1;VINCES;1745;UNIDAD EDUCATIVA VINCES
12;LOS RIOS;0;;525;VINCES;6245;VINCES;U;1;VINCES;1743;UNIDAD EDUCATIVA DIEZ DE AGOSTO
12;LOS RIOS;0;;525;VINCES;6245;VINCES;U;1;VINCES;1872;ESCUELA DE EDUCACION BASICA DR LORENZO RUFFO PEÑA
12;LOS RIOS;0;;525;VINCES;6245;VINCES;U;1;VINCES;1871;ESCUELA DE EDUCACION BASICA GUAYAQUIL
12;LOS RIOS;0;;525;VINCES;6245;VINCES;U;1;VINCES;1848;ESCUELA DE EDUCACION BASICA CARLOS COELLO ICAZA
12;LOS RIOS;0;;525;VINCES;6245;VINCES;U;1;VINCES;1861;ESCUELA DE EDUCACION BASICA DR. FRANCISCO MARTINEZ AGUIRRE
12;LOS RIOS;0;;525;VINCES;6245;VINCES;U;1;VINCES;1829;ESCUELA DE EDUCACION BASICA ANGEL VELIZ MENDOZA
12;LOS RIOS;0;;525;VINCES;6245;VINCES;U;1;VINCES;37;ESCUELA DE EDUCACION BASICA CIUDAD DE VINCES
12;LOS RIOS;0;;525;VINCES;6245;VINCES;U;1;VINCES;5008;UNIDAD EDUCATIVA JOSE DE ANTEPARA
12;LOS RIOS;0;;525;VINCES;6245;VINCES;U;1;VINCES;4995;ESCUELA DE EDUCACION BASICA CATORCE DE JUNIO
12;LOS RIOS;0;;525;VINCES;6245;VINCES;U;1;VINCES;6110;POLIDEPORTIVO VICTOR MOSCOSO
12;LOS RIOS;0;;525;VINCES;6245;VINCES;U;2;BALZAR DE VINCES;3962;"ESCUELA DE EDUCACIÓN BÁSICA ""CÉSAR ARTURO SOTOMAYOR"""
12;LOS RIOS;0;;525;VINCES;6245;VINCES;U;3;LA MECHA;3970;"UNIDAD EDUCATIVA ""JACINTO CARLIER CASTRO"""
12;LOS RIOS;0;;525;VINCES;6245;VINCES;U;4;MACUL;3946;UNIDAD EDUCATIVA LIC. RAFAEL SOTOMAYOR GALLARDO
12;LOS RIOS;0;;530;PUEBLO VIEJO;3015;PUERTO PECHICHE;R;0;;1413;ESCUELA DE EDUCACION BASICA GRAN COLOMBIA
12;LOS RIOS;0;;530;PUEBLO VIEJO;3510;SAN JUAN;R;0;;1845;UNIDAD EDUCATIVA LEON DE FEBRES CORDERO
12;LOS RIOS;0;;530;PUEBLO VIEJO;3510;SAN JUAN;R;0;;1410;UNIDAD EDUCATIVA SAN JUAN
12;LOS RIOS;0;;530;PUEBLO VIEJO;3510;SAN JUAN;R;0;;6062;COLISEO DE DEPORTES SAN JUAN
12;LOS RIOS;0;;530;PUEBLO VIEJO;5800;PUEBLO VIEJO;U;0;;1661;UNIDAD EDUCATIVA PUEBLO VIEJO
12;LOS RIOS;0;;530;PUEBLO VIEJO;5800;PUEBLO VIEJO;U;0;;1653;ESCUELA DE EDUCACION BASICA ESPAÑA
12;LOS RIOS;0;;530;PUEBLO VIEJO;5800;PUEBLO VIEJO;U;0;;1943;ESCUELA DE EDUCACION BASICA MIGUEL SUAREZ SEMINARIO
12;LOS RIOS;0;;530;PUEBLO VIEJO;5800;PUEBLO VIEJO;U;0;;6064;COLISEO DE DEPORTE DE LA LIGA CANTONAL DE PUEBLO VIEJO
12;LOS RIOS;0;;535;URDANETA;3175;RICAURTE;R;1;RICAURTE;1973;UNIDAD EDUCATIVA RICAURTE
12;LOS RIOS;0;;535;URDANETA;3175;RICAURTE;R;1;RICAURTE;1864;ESCUELA DE EDUCACION BASICA GABRIEL GARCIA MORENO
12;LOS RIOS;0;;535;URDANETA;3175;RICAURTE;R;2;SALAMPE;3939;"UNIDAD EDUCATIVA ""ANTONIO JOSE DE SUCRE"""
12;LOS RIOS;0;;535;URDANETA;3175;RICAURTE;R;3;LA INDUSTRIA;3937;"ESCUELA DE EDUCACION BASICA ""YAGUACHI"""
12;LOS RIOS;0;;535;URDANETA;3175;RICAURTE;R;4;SAN JOSE DE PIJULLO;3928;ESCUELA DE EDUCACION BASICA OCTAVIO GERARDO ICAZA
12;LOS RIOS;0;;535;URDANETA;3175;RICAURTE;R;5;LA HOJITA;3936;"ESCUELA DE EDUCACION BASICA ""6 DE OCTUBRE"""
12;LOS RIOS;0;;535;URDANETA;3175;RICAURTE;R;6;POTOSI;3935;UNIDAD EDUCATIVA POTOSI
12;LOS RIOS;0;;535;URDANETA;5185;CATARAMA;U;0;;1985;UNIDAD EDUCATIVA 11 DE OCTUBRE
12;LOS RIOS;0;;535;URDANETA;5185;CATARAMA;U;0;;5436;ESCUELA DE EDUCACIÓN BASICA ABDON CALDERON
12;LOS RIOS;0;;540;QUEVEDO;4420;LA ESPERANZA;R;0;;1902;UNIDAD EDUCATIVA MANUEL VITERI CAMACHO
12;LOS RIOS;0;;540;QUEVEDO;4425;SAN CARLOS;R;0;;1926;UNIDAD EDUCATIVA SAN CARLOS
12;LOS RIOS;0;;540;QUEVEDO;5855;QUEVEDO;U;1;QUEVEDO;2058;UNIDAD EDUCATIVA AMERICA
12;LOS RIOS;0;;540;QUEVEDO;5855;QUEVEDO;U;1;QUEVEDO;1860;ESCUELA DE EDUCACION BASICA QUITO
12;LOS RIOS;0;;540;QUEVEDO;5855;QUEVEDO;U;1;QUEVEDO;1828;ESCUELA DE EDUCACION BASICA MANUEL DE JESUS CALLE
12;LOS RIOS;0;;540;QUEVEDO;5855;QUEVEDO;U;1;QUEVEDO;1942;ESCUELA DE EDUCACION BASICA OTTO AROSEMENA GOMEZ
12;LOS RIOS;0;;540;QUEVEDO;5855;QUEVEDO;U;1;QUEVEDO;2051;ESCUELA DE EDUCACION BASICA CARLOS JULIO AROSEMENA TOLA
12;LOS RIOS;0;;540;QUEVEDO;5855;QUEVEDO;U;1;QUEVEDO;5435;COLISEO DE DEPORTES WELLINTONG CHANG LÚA - QUEVEDO
12;LOS RIOS;0;;540;QUEVEDO;5855;QUEVEDO;U;1;QUEVEDO;1937;ESCUELA DE EDUCACION BASICA NUESTRA SEÑORA DE FATIMA
12;LOS RIOS;0;;540;QUEVEDO;5855;QUEVEDO;U;2;QUEVEDO NORTE;1890;UNIDAD EDUCATIVA QUEVEDO
12;LOS RIOS;0;;540;QUEVEDO;5855;QUEVEDO;U;2;QUEVEDO NORTE;2046;UNIVERSIDAD TECNICA ESTATAL DE QUEVEDO
12;LOS RIOS;0;;540;QUEVEDO;5855;QUEVEDO;U;2;QUEVEDO NORTE;1901;ESCUELA DE EDUCACION BASICA JOSE ISAAC MONTES
12;LOS RIOS;0;;540;QUEVEDO;5855;QUEVEDO;U;2;QUEVEDO NORTE;1939;UNIDAD EDUCATIVA ELOY ALFARO
12;LOS RIOS;0;;540;QUEVEDO;5855;QUEVEDO;U;89;VOTO EN CASA;0;
12;LOS RIOS;0;;540;QUEVEDO;6115;SAN CAMILO;U;0;;1877;UNIDAD EDUCATIVA NICOLAS INFANTE DIAZ
12;LOS RIOS;0;;540;QUEVEDO;6115;SAN CAMILO;U;0;;1695;UNIDAD EDUCATIVA UNIDAD POPULAR
12;LOS RIOS;0;;540;QUEVEDO;6115;SAN CAMILO;U;0;;1913;UNIDAD EDUCATIVA SAN CAMILO
12;LOS RIOS;0;;540;QUEVEDO;6635;SAN CRISTOBAL;U;0;;2042;ESCUELA DE EDUCACION BASICA CELESTE CARLIER FUENTES
12;LOS RIOS;0;;540;QUEVEDO;6635;SAN CRISTOBAL;U;89;VOTO EN CASA;0;
12;LOS RIOS;0;;540;QUEVEDO;6640;VENUS DEL RIO QUEVEDO;U;0;;1923;ESCUELA DE EDUCACION BASICA CARLOS FINLAY
12;LOS RIOS;0;;540;QUEVEDO;6640;VENUS DEL RIO QUEVEDO;U;0;;1865;UNIDAD EDUCATIVA DR MANUEL QUINTANA MIRANDA
12;LOS RIOS;0;;540;QUEVEDO;6640;VENUS DEL RIO QUEVEDO;U;0;;6024;ESCUELA DE EDUCACIÓN BASICA LENIN
12;LOS RIOS;0;;540;QUEVEDO;6645;NICOLAS INFANTE DIAZ;U;0;;1908;ESCUELA DE EDUCACION BASICA ARNULFO CHAVEZ MIRANDA
12;LOS RIOS;0;;540;QUEVEDO;6650;GUAYACAN;U;0;;1671;UNIDAD EDUCATIVA LOS GUAYACANES
12;LOS RIOS;0;;540;QUEVEDO;6650;GUAYACAN;U;0;;1659;ESCUELA DE EDUCACION BASICA FAUSTO MOLINA MOLINA
12;LOS RIOS;0;;540;QUEVEDO;6655;SIETE DE OCTUBRE;U;0;;2060;UNIDAD EDUCATIVA SIETE DE OCTUBRE
12;LOS RIOS;0;;540;QUEVEDO;6655;SIETE DE OCTUBRE;U;0;;1934;ESCUELA DE EDUCACION BASICA GENERAL QUISQUIS
12;LOS RIOS;0;;540;QUEVEDO;6660;VIVA ALFARO;U;0;;1822;ESCUELA DE EDUCACION BASICA JORGE CARRERA ANDRADE
12;LOS RIOS;0;;540;QUEVEDO;6690;24 DE MAYO;U;0;;4997;UNIDAD EDUCATIVA REPLICA NICOLAS INFANTE DIAZ
12;LOS RIOS;0;;545;VENTANAS;4330;ZAPOTAL;R;1;ZAPOTAL;2031;UNIDAD EDUCATIVA ZAPOTAL
12;LOS RIOS;0;;545;VENTANAS;4330;ZAPOTAL;R;1;ZAPOTAL;3944;"ESCUELA DE EDUCACIÓN BÁSICA ""PICHINCHA"""
12;LOS RIOS;0;;545;VENTANAS;4330;ZAPOTAL;R;2;NUEVO ZAPOTAL;3968;ESCUELA DE EDUCACIÓN BÁSICA 3 DE NOVIEMBRE
12;LOS RIOS;0;;545;VENTANAS;4330;ZAPOTAL;R;3;TARIRA;3933;EX - UNIDAD EDUCATIVA SIMON RODRIGUEZ
12;LOS RIOS;0;;545;VENTANAS;4330;ZAPOTAL;R;4;AGUAS FRIAS DE MEDELLIN;3929;ESCUELA DE EDUCACION BASICA PEDRO EGUEZ BAQUERIZO
12;LOS RIOS;0;;545;VENTANAS;4585;LOS ANGELES;R;0;;3943;ESCUELA DE EDUCACION BASICA MANUELITA SAENZ
12;LOS RIOS;0;;545;VENTANAS;4590;CHACARITA;R;0;;1373;"ESCUELA DE EDUCACION BASICA ""REMIGIO ROMERO Y CORDERO"""
12;LOS RIOS;0;;545;VENTANAS;6235;VENTANAS;U;1;VENTANAS;1957;UNIDAD EDUCATIVA 6 DE OCTUBRE
12;LOS RIOS;0;;545;VENTANAS;6235;VENTANAS;U;1;VENTANAS;1954;UNIDAD EDUCATIVA HUMBERTO MOREIRA MARQUEZ
12;LOS RIOS;0;;545;VENTANAS;6235;VENTANAS;U;1;VENTANAS;1972;ESCUELA DE EDUCACION BASICA ISIDRO AYORA CUEVA
12;LOS RIOS;0;;545;VENTANAS;6235;VENTANAS;U;1;VENTANAS;1974;ESCUELA DE EDUCACION BASICA ADOLFO JURADO GONZALEZ
12;LOS RIOS;0;;545;VENTANAS;6235;VENTANAS;U;1;VENTANAS;4151;COLISEO DE DEPORTES
12;LOS RIOS;0;;545;VENTANAS;6235;VENTANAS;U;1;VENTANAS;6125;UNIDAD EDUCATIVA ANA ROSA VALDIVIEZO DE LANDIVAR
12;LOS RIOS;0;;545;VENTANAS;6235;VENTANAS;U;1;VENTANAS;6123;ESCUELA DE EDUCACIÓN BASICA 10 DE NOVIEMBRE
12;LOS RIOS;0;;545;VENTANAS;6235;VENTANAS;U;1;VENTANAS;6190;ESCUELA DE EDUCACION BASICA AUDIENCIA DE QUITO
12;LOS RIOS;0;;545;VENTANAS;6235;VENTANAS;U;1;VENTANAS;6147;ESCUELA DE EDUCACION BASICA CIUDAD DE VENTANAS
12;LOS RIOS;0;;545;VENTANAS;6235;VENTANAS;U;2;LAS MALVINAS;4992;"UNIDAD EDUCATIVA ""VENTANAS"""
12;LOS RIOS;0;;545;VENTANAS;7480;10-nov;U;0;;3926;UNIDAD EDUCATIVA MANUEL CORDOVA GALARZA
12;LOS RIOS;0;;546;QUINSALOMA;6915;QUINSALOMA;U;1;QUINSALOMA;2022;UNIDAD EDUCATIVA 16 DE MAYO
12;LOS RIOS;0;;546;QUINSALOMA;6915;QUINSALOMA;U;1;QUINSALOMA;2028;ESCUELA DE EDUCACION BASICA CALICUCHIMA
12;LOS RIOS;0;;546;QUINSALOMA;6915;QUINSALOMA;U;2;PAMBILAR DE CALOPE;3964;ESCUELA DE EDUCACION BASICA GENERAL VICENTE ANDA AGUIRRE
12;LOS RIOS;0;;710;MONTALVO;4615;LA ESMERALDA;R;0;;3932;UNIDAD EDUCATIVA MONTALVO
12;LOS RIOS;0;;710;MONTALVO;5640;MONTALVO /SABANETA;U;1;MONTALVO /SABANETA;293;ESCUELA DE EDUCACION BASICA JUAN LEON MERA
12;LOS RIOS;0;;710;MONTALVO;5640;MONTALVO /SABANETA;U;1;MONTALVO /SABANETA;286;ESCUELA DE EDUCACION BASICA FEDERICO GONZALEZ SUAREZ
12;LOS RIOS;0;;710;MONTALVO;5640;MONTALVO /SABANETA;U;1;MONTALVO /SABANETA;142;UNIDAD EDUCATIVA 10 DE AGOSTO
12;LOS RIOS;0;;710;MONTALVO;5640;MONTALVO /SABANETA;U;1;MONTALVO /SABANETA;201;ESCUELA DE EDUCACION BASICA LA INMACULADA
12;LOS RIOS;0;;710;MONTALVO;5640;MONTALVO /SABANETA;U;1;MONTALVO /SABANETA;6102;UNIDAD EDUCATIVA JAIME ROLDOS AGUILERA - BLOQUE 1
12;LOS RIOS;0;;710;MONTALVO;5640;MONTALVO /SABANETA;U;1;MONTALVO /SABANETA;6100;UNIDAD EDUCATIVA JAIME ROLDOS AGUILERA - BLOQUE 2
12;LOS RIOS;0;;710;MONTALVO;5640;MONTALVO /SABANETA;U;2;LA PRETORIA;6213;ESCUELA DE EDUCACIÓN BASICA RAFAEL MORAN VALVERDE
12;LOS RIOS;0;;750;PALENQUE;6330;PALENQUE;U;1;PALENQUE;1952;UNIDAD EDUCATIVA LAUTARO ASPIAZU SEDEÑO
12;LOS RIOS;0;;750;PALENQUE;6330;PALENQUE;U;1;PALENQUE;1868;ESCUELA DE EDUCACION BASICA DOLORES SUCRE
