COD_PROVINCIA;NOM_PROVINCIA;COD_CIRCUNSCRIPCION;NOM_CIRCUNSCRIPCION;COD_CANTON;NOM_CANTON;COD_PARROQUIA;NOM_PARROQUIA;EST_PARROQUIA;COD_ZONA;NOM_ZONA;COD_RECINTO;NOM_RECINTO
1;AZUAY;0;;260;CUENCA;285;BAÑOS;R;1;BAÑOS;1005;UNIDAD EDUCATIVA MANUEL CORDOVA GALARZA
1;AZUAY;0;;260;CUENCA;285;BAÑOS;R;1;BAÑOS;978;ESCUELA DE EDUCACIÓN BÁSICA ENRIQUETA CORDERO DAVILA
1;AZUAY;0;;260;CUENCA;285;BAÑOS;R;1;BAÑOS;987;UNIDAD EDUCATIVA ALFONSO CARRION HEREDIA
1;AZUAY;0;;260;CUENCA;285;BAÑOS;R;1;BAÑOS;6306;UNIDAD EDUCATIVA BORJA-ESCUELA
1;AZUAY;0;;260;CUENCA;285;BAÑOS;R;1;BAÑOS;6027;UNIDAD EDUCATIVA PARTICULAR BORJA-COLEGIO
1;AZUAY;0;;260;CUENCA;285;BAÑOS;R;2;COCHAPAMBA;1521;CENTRO EDUCATIVO COMUNITARIO INTERCULTURAL BILINGÜE DE BACHILLERATO NARANCAY/COLEGIO INTERCULTURAL BILINGÜE NARANCAY
1;AZUAY;0;;260;CUENCA;730;CUMBE;R;0;;928;UNIDAD EDUCATIVA CUMBE / COLEGIO NACIONAL TECNICO DE CUMBE
1;AZUAY;0;;260;CUENCA;730;CUMBE;R;0;;1015;ESCUELA DE EDUCACION BASICA GENERAL GABRIEL ARSENIO ULLAURI
1;AZUAY;0;;260;CUENCA;845;CHAUCHA / ANGAS;R;1;CHAUCHA /ANGAS;2196;UNIDAD EDUCATIVA SAN GABRIEL DE CHAUCHA
1;AZUAY;0;;260;CUENCA;845;CHAUCHA / ANGAS;R;2;SAN ANTONIO;2327;ESCUELA DE EDUCACION BASICA ECUADOR AMAZONICO
1;AZUAY;0;;260;CUENCA;845;CHAUCHA / ANGAS;R;3;CEDRO;2328;ESCUELA FISCAL CORNELIO HIDALGO CASTRO
1;AZUAY;0;;260;CUENCA;845;CHAUCHA / ANGAS;R;4;CASCAJO;2206;ESCUELA LEONCIO GALLEGOS SOLANO
1;AZUAY;0;;260;CUENCA;860;CHECA JIDCAY;R;0;;623;UNIDAD EDUCATIVA CHECA/COLEGIO CHECA
1;AZUAY;0;;260;CUENCA;905;CHIQUINTAD;R;0;;1332;UNIDAD EDUCATIVA CHIQUINTAD (COLEGIO NACIONAL TECNICO CHIQUINTAD
1;AZUAY;0;;260;CUENCA;2255;LLACAO;R;0;;1267;ESCUELA DE EDUCACION BASICA GONZALO S. CORDOVA
1;AZUAY;0;;260;CUENCA;2430;MOLLETURO;R;1;MOLLETURO;464;UNIDAD EDUCATIVA MOLLETURO/COLEGIO MOLLETURO
1;AZUAY;0;;260;CUENCA;2430;MOLLETURO;R;1;MOLLETURO;455;ESCUELA DE EDUCACION BASICA JUAN LEON MERA
1;AZUAY;0;;260;CUENCA;2430;MOLLETURO;R;2;JESUS DEL GRAN PODER;2530;UNIDAD EDUCATIVA JESÚS DEL GRAN PODER
1;AZUAY;0;;260;CUENCA;2430;MOLLETURO;R;3;ZHAGAL;2284;UNIDAD EDUCATIVA LUZ Y GUIA/ESCUELA 1 DE MAYO
1;AZUAY;0;;260;CUENCA;2430;MOLLETURO;R;4;SAN JOSE DE RECREO;2490;ESCUELA 19 DE MARZO
1;AZUAY;0;;260;CUENCA;2430;MOLLETURO;R;5;TAMARINDO;2085;ESCUELA DE EDUCACION BASICA 15 DE AGOSTO
1;AZUAY;0;;260;CUENCA;2430;MOLLETURO;R;6;AGUAS CALIENTES;2528;ESCUELA DE EDUCACION BASICA SANTA ANA DE LOS RIOS
1;AZUAY;0;;260;CUENCA;2430;MOLLETURO;R;7;ESTERO PIEDRA;1964;UNIDAD EDUCATIVA ESTERO PIEDRA
1;AZUAY;0;;260;CUENCA;2430;MOLLETURO;R;8;ABDON CALDERÓN;31;UNIDAD EDUCATIVA ABDON CALDERON/ESCUELA FISCAL MIXTA PRIMERO DE ENERO
1;AZUAY;0;;260;CUENCA;2430;MOLLETURO;R;9;FLOR Y SELVA;3477;ESCUELA DE EDUCACION BASICA MANUELA GARAICOA DE CALDERON
1;AZUAY;0;;260;CUENCA;2430;MOLLETURO;R;10;CAYMATAN ;5006;ESCUELA DE EDUCACION BASICA 6 DE ENERO
1;AZUAY;0;;260;CUENCA;2570;MULTI /  NULTI;R;1;MULTI /  NULTI;47;UNIDAD EDUCATIVA NULTI-ESCUELA MANUEL RAMON BALAREZO
1;AZUAY;0;;260;CUENCA;2570;MULTI /  NULTI;R;2;CHALLUABAMBA NULTI;2952;UNIDAD EDUCATIVA FRANCISCO EUGENIO TAMARIZ
1;AZUAY;0;;260;CUENCA;2595;OCTAVIO CORDERO PALACIOS;R;0;;2083;UNIDAD EDUCATIVA SANTA ROSA/ESCUELA EZEQUIEL MARQUEZ
1;AZUAY;0;;260;CUENCA;2680;PACCHA;R;0;;62;UNIDAD EDUCATIVA PACCHA- ESCUELA FISCAL MIXTA MANUEL CORONEL
1;AZUAY;0;;260;CUENCA;3105;QUINGEO;R;1;QUINGEO;4601;UNIDAD EDUCATIVA DEL MILENIO QUINGEO
1;AZUAY;0;;260;CUENCA;3105;QUINGEO;R;2;MONJAS;2070;UNIDAD EDUCATIVA MONSEÑOR LEONIDAS PROAÑO II
1;AZUAY;0;;260;CUENCA;3105;QUINGEO;R;3;PIRICOCHA;5025;UNIDAD EDUCATIVA AMADEO MALDONADO VAZQUEZ
1;AZUAY;0;;260;CUENCA;3165;RICAURTE;R;1;RICAURTE;1220;ESCUELA EDUCACION GENERAL BASICA ESTADOS UNIDOS DE NORTEAMERICA
1;AZUAY;0;;260;CUENCA;3165;RICAURTE;R;1;RICAURTE;1119;ESCUELA DE EDUCACIÓN BÁSICA ISAAC A. CHICO
1;AZUAY;0;;260;CUENCA;3165;RICAURTE;R;1;RICAURTE;5858;UNIDAD EDUCATIVA PARTICULAR SUDAMERICANO
1;AZUAY;0;;260;CUENCA;3165;RICAURTE;R;2;LA DOLOROSA;5048;ESCUELA DE EDUCACION BASICA MANUEL MARIA PALACIO BRAVO
1;AZUAY;0;;260;CUENCA;3460;SAN JOAQUIN;R;1;SAN JOAQUIN;1614;UNIDAD EDUCATIVA SAN JOAQUIN/ESCUELA RAFAEL MARIA ARIZAGA
1;AZUAY;0;;260;CUENCA;3460;SAN JOAQUIN;R;1;SAN JOAQUIN;1627;ESCUELA DE EDUCACION BASICA GENERAL ANTONIO FARFAN
1;AZUAY;0;;260;CUENCA;3460;SAN JOAQUIN;R;2;BARABON;1391;UNIDAD EDUCATIVA/ESCUELA DE EDUCACION BASICA EDUARDO CRESPO MALO
1;AZUAY;0;;260;CUENCA;3685;SANTA ANA;R;0;;1204;ESCUELA DE EDUCACION BASICA ALFONSO MARIA BORRERO
1;AZUAY;0;;260;CUENCA;3685;SANTA ANA;R;0;;5935;UNIDAD EDUCATIVA DANIEL HERMIDA
1;AZUAY;0;;260;CUENCA;3795;SAYAUSI;R;1;SAYAUSI;4588;UNIDAD EDUCATIVA DEL MILENIO UEM SAYAUSI
1;AZUAY;0;;260;CUENCA;3795;SAYAUSI;R;1;SAYAUSI;5885;UNIDAD EDUCATIVA PARTICULAR LA ALBORADA
1;AZUAY;0;;260;CUENCA;3795;SAYAUSI;R;2;SAN MIGUEL;2939;ESCUELA DE EDUCACION BASICA JOAQUIN MALO TAMARIZ
1;AZUAY;0;;260;CUENCA;3795;SAYAUSI;R;3;BELLAVISTA;5059;CASA COMUNAL BELLAVISTA
1;AZUAY;0;;260;CUENCA;3850;SIDCAY;R;1;SIDCAY;775;ESCUELA DE EDUCACIÓN BASICA MIGUEL PRIETO
1;AZUAY;0;;260;CUENCA;3850;SIDCAY;R;2;BIBIN;2990;ESCUELA DE EDUCACION BASICA ROSARIO PRIETO DE FARFAN
1;AZUAY;0;;260;CUENCA;3850;SIDCAY;R;3;ALTOS DE MACHANGARA;2945;UNIDAD EDUCATIVA DORA BEATRIZ CANELOS
1;AZUAY;0;;260;CUENCA;3870;SININCAY;R;1;SININCAY;34;UNIDAD EDUCATIVA SININCAY/ESCUELA JUAN DE DIOS CORRAL
1;AZUAY;0;;260;CUENCA;3870;SININCAY;R;1;SININCAY;720;ESCUELA DE EDUCACION BASICA CAROLINA DE FEBRES CORDERO
1;AZUAY;0;;260;CUENCA;3870;SININCAY;R;2;CRUCE DEL CARMEN;2944;ESCUELA DE EDUCACIÓN GENERAL BASICA PADRE JUAN CARLO
1;AZUAY;0;;260;CUENCA;3870;SININCAY;R;3;SAN JOSE DE BALZAY;5015;UNIDAD EDUCATIVA REYNALDO CHICO GARCIA
1;AZUAY;0;;260;CUENCA;3980;TARQUI;R;1;TARQUI;1124;UNIDAD EDUCATIVA FAUSTO MOLINA
1;AZUAY;0;;260;CUENCA;3980;TARQUI;R;1;TARQUI;1223;ESCUELA DE EDUCACION BASICA ALFONSO MORENO MORA
1;AZUAY;0;;260;CUENCA;3980;TARQUI;R;2;TUTUPALI BAJO;855;ESCUELA DE EDUCACION BASICA JUAN CONTRERAS HURTADO
1;AZUAY;0;;260;CUENCA;3980;TARQUI;R;3;GULLANZHAPA;6001;ESCUELA DE EDUCACION BASICA MIGUEL MOROCHO
1;AZUAY;0;;260;CUENCA;4095;TURI;R;0;;1064;UNIDAD EDUCATIVA TURI
1;AZUAY;0;;260;CUENCA;4095;TURI;R;0;;5949;ESCUELA DE EDUCACION BASICA JOSE RAFAEL ARIZAGA
1;AZUAY;0;;260;CUENCA;4200;VALLE;R;1;VALLE;831;UNIDAD EDUCATIVA GUILLERMO MENSI
1;AZUAY;0;;260;CUENCA;4200;VALLE;R;1;VALLE;799;ESCUELA DE EDUCACION BASICA MANUEL GUERRERO
1;AZUAY;0;;260;CUENCA;4200;VALLE;R;1;VALLE;5933;ESCUELA DE EDUCACION BASICA JOSE TOMAS RENDON SOLANO
1;AZUAY;0;;260;CUENCA;4200;VALLE;R;2;CHILCAPAMBA;2288;ESCUELA DE EDUCACIÓN BASICA ELOY ALFARO / ESCUELA ELOY ALFARO
1;AZUAY;0;;260;CUENCA;4200;VALLE;R;3;GUALALCAY;2521;ESCUELA DE EDUCACIÓN BÁSICA RAMÓN BORRERO
1;AZUAY;0;;260;CUENCA;4225;VICTORIA DEL PORTETE;R;0;;1247;UNIDAD EDUCATIVA DEL MILENIO VICTORIA DEL PORTETE
1;AZUAY;0;;260;CUENCA;5075;BELLAVISTA;U;0;;418;ESCUELA DE EDUCACION BASICA FISCOMISIONAL PADRE CARLOS CRESPI
1;AZUAY;0;;260;CUENCA;5075;BELLAVISTA;U;0;;469;ESCUELA DE EDUCACION GENERAL BASICA FEDERICO PROAÑO
1;AZUAY;0;;260;CUENCA;5075;BELLAVISTA;U;0;;465;UNIDAD EDUCATIVA 3 DE NOVIEMBRE
1;AZUAY;0;;260;CUENCA;5075;BELLAVISTA;U;0;;6003;UNIVERSIDAD CATOLICA DE CUENCA FACULTAD DE ARQUITECTURA
1;AZUAY;0;;260;CUENCA;5075;BELLAVISTA;U;0;;5848;UNIDAD EDUCATIVA ALBERTO ANDRADE ARIZAGA BRUMEL
1;AZUAY;0;;260;CUENCA;5080;CAÑARIBAMBA;U;0;;339;UNIDAD EDUCATIVA CESAR DAVILA ANDRADE / COLEGIO CESAR DAVILA ANDRADE
1;AZUAY;0;;260;CUENCA;5080;CAÑARIBAMBA;U;0;;410;UNIDAD EDUCATIVA ZOILA AURORA PALACIOS / ESCUELA ZOILA AURORA PALACIOS
1;AZUAY;0;;260;CUENCA;5080;CAÑARIBAMBA;U;0;;5876;ESCUELA DE EDUCACION BASICA JULIO ABAD CHICA
1;AZUAY;0;;260;CUENCA;5135;EL BATAN;U;0;;1016;COLISEO MAYOR JEFFERSON PEREZ
1;AZUAY;0;;260;CUENCA;5135;EL BATAN;U;0;;1038;ESCUELA DE EDUCACION BASICA 12 DE ABRIL
1;AZUAY;0;;260;CUENCA;5135;EL BATAN;U;0;;896;UNIDAD EDUCATIVA MIGUEL MORENO ORDOÑEZ
1;AZUAY;0;;260;CUENCA;5135;EL BATAN;U;0;;6297;ESCUELA DE EDUCACION BASICA VICTOR MANUEL ALBORNOZ
1;AZUAY;0;;260;CUENCA;5140;MACHANGARA;U;1;MACHÁNGARA;1478;UNIDAD EDUCATIVA CAZADORES DE LOS RIOS
1;AZUAY;0;;260;CUENCA;5140;MACHANGARA;U;1;MACHÁNGARA;1035;UNIDAD EDUCATIVA MARIO RIZINI
1;AZUAY;0;;260;CUENCA;5140;MACHANGARA;U;1;MACHÁNGARA;5869;UNIDAD EDUCATIVA PARTICULAR KENNEDY
1;AZUAY;0;;260;CUENCA;5140;MACHANGARA;U;2;CAPULISPAMBA;1437;UNIDAD EDUCATIVA ENRIQUE MALO ANDRADE
1;AZUAY;0;;260;CUENCA;5140;MACHANGARA;U;3;CHALLUABAMBA MACHANGARA;2532;UNIDAD PARTICULAR COLEGIO ALEMÁN STIEHLE DE CUENCA
1;AZUAY;0;;260;CUENCA;5140;MACHANGARA;U;4;OCHOA LEON;5022;CASA COMUNAL OCHOA LEON
1;AZUAY;0;;260;CUENCA;5290;MONAY;U;0;;592;UNIDAD EDUCATIVA DEL MILENIO MANUELA GARAICOA DE CALDERON
1;AZUAY;0;;260;CUENCA;5290;MONAY;U;0;;6307;UNIDAD EDUCATIVA DEL MILENIO GARAICOA- COLISEO
1;AZUAY;0;;260;CUENCA;5290;MONAY;U;0;;5882;UNIDAD EDUCATIVA LATINOAMERICANA
1;AZUAY;0;;260;CUENCA;5330;EL VECINO;U;1;EL VECINO;467;UNIDAD EDUCATIVA DEL MILENIO MANUEL J CALLE/ COLEGIO MANUEL J CALLE
1;AZUAY;0;;260;CUENCA;5330;EL VECINO;U;1;EL VECINO;6006;UNIDAD EDUCATIVA MANUEL J CALLE - COLISEO
1;AZUAY;0;;260;CUENCA;5330;EL VECINO;U;1;EL VECINO;797;UNIDAD EDUCATIVA ZOILA ESPERANZA PALACIOS/ESCUELA ESPAÑA
1;AZUAY;0;;260;CUENCA;5330;EL VECINO;U;1;EL VECINO;790;UNIVERSIDAD POLITECNICA SALESIANA-ADMINISTRACION CENTRAL
1;AZUAY;0;;260;CUENCA;5330;EL VECINO;U;1;EL VECINO;5965;UNIVERSIDAD POLITECNICA DE CUENCA- COLISEO
1;AZUAY;0;;260;CUENCA;5330;EL VECINO;U;1;EL VECINO;6007;UNIVERSIDAD POLITECNICA- FACULTAD DE ECONOMIA
1;AZUAY;0;;260;CUENCA;5330;EL VECINO;U;1;EL VECINO;820;UNIDAD EDUCATIVA JUAN MONTALVO
1;AZUAY;0;;260;CUENCA;5330;EL VECINO;U;1;EL VECINO;834;UNIDAD EDUCATIVA FRANCISCA DAVILA DE MUÑOZ
1;AZUAY;0;;260;CUENCA;5330;EL VECINO;U;1;EL VECINO;5963;ESCUELA DE EDUCACION BASICA REPUBLICA DE CHILE
1;AZUAY;0;;260;CUENCA;5330;EL VECINO;U;1;EL VECINO;5980;ESCUELA DE EDUCACION BASICA MARY CORYLE
1;AZUAY;0;;260;CUENCA;5330;EL VECINO;U;2;MIRAFLORES;4587;UNIDAD EDUCATIVA LUIS MONSALVE POZO
1;AZUAY;0;;260;CUENCA;5330;EL VECINO;U;3;LA CATÓLICA;5940;UNIDAD EDUCATIVA LUIS ROBERTO BRAVO
1;AZUAY;0;;260;CUENCA;5330;EL VECINO;U;89;VOTO EN CASA;0;
1;AZUAY;0;;260;CUENCA;5360;TOTORACOCHA;U;0;;1472;UNIDAD EDUCATIVA HERLINDA TORAL-AULAS
1;AZUAY;0;;260;CUENCA;5360;TOTORACOCHA;U;0;;5989;UNIDAD EDUCATIVA HERLINDA TORAL COLISEO
1;AZUAY;0;;260;CUENCA;5360;TOTORACOCHA;U;0;;1543;UNIDAD EDUCATIVA ABELARDO TAMARIZ CRESPO
1;AZUAY;0;;260;CUENCA;5360;TOTORACOCHA;U;0;;1518;UNIDAD EDUCATIVA LA INMACULADA
1;AZUAY;0;;260;CUENCA;5360;TOTORACOCHA;U;0;;6004;COLISEO POLIDEPORTIVO TOTORACOCHA
1;AZUAY;0;;260;CUENCA;5360;TOTORACOCHA;U;0;;5952;UNIDAD EDUCATIVA RICARDO MUÑOZ CHAVEZ
1;AZUAY;0;;260;CUENCA;5360;TOTORACOCHA;U;89;VOTO EN CASA;0;
1;AZUAY;0;;260;CUENCA;5370;YANUNCAY;U;1;YANUNCAY;505;UNIDAD EDUCATIVA FISCOMISIONAL TÉCNICO SALESIANO/INSTITUTO TECNICO SUPERIOR SALESIANO
1;AZUAY;0;;260;CUENCA;5370;YANUNCAY;U;1;YANUNCAY;803;ESCUELA DE EDUCACIÓN BÁSICA NICOLÁS SOJOS
1;AZUAY;0;;260;CUENCA;5370;YANUNCAY;U;1;YANUNCAY;932;ESCUELA BASICA JOSE MARIA VELASCO IBARRA
1;AZUAY;0;;260;CUENCA;5370;YANUNCAY;U;1;YANUNCAY;6546;ESCUELA DE EDUCACIÓN FRANCISCA ARIZAGA T.
1;AZUAY;0;;260;CUENCA;5370;YANUNCAY;U;1;YANUNCAY;5958;ESCUELA DE EDUCACION BASICA IGNACIO ESCANDON
1;AZUAY;0;;260;CUENCA;5370;YANUNCAY;U;1;YANUNCAY;5966;UNIDAD EDUCATIVA FRAY VICENTE SOLANO
1;AZUAY;0;;260;CUENCA;5370;YANUNCAY;U;2;MISICATA;5943;UNIDAD DEL MILENIO FEBRES CORDERO
1;AZUAY;0;;260;CUENCA;5450;HUAYNACAPAC;U;0;;397;UNIDAD EDUCATIVA PARTICULAR HERMANO MIGUEL DE LA SALLE
1;AZUAY;0;;260;CUENCA;5450;HUAYNACAPAC;U;0;;475;ESCUELA DE EDUCACION GENERAL BASICA GABRIELA MISTRAL
1;AZUAY;0;;260;CUENCA;5450;HUAYNACAPAC;U;0;;653;UNIDAD EDUCATIVA FE Y ALEGRIA
1;AZUAY;0;;260;CUENCA;5450;HUAYNACAPAC;U;0;;6030;UNIVERSIDAD DEL AZUAY
1;AZUAY;0;;260;CUENCA;5875;RAMIREZ DAVALOS;U;0;;927;UNIDAD EDUCATIVA SANTA MARIANITA DE JESUS
1;AZUAY;0;;260;CUENCA;5875;RAMIREZ DAVALOS;U;0;;857;UNIDAD EDUCATIVA PARTICULAR DOMINICANA SAN LUIS BELTRAN
1;AZUAY;0;;260;CUENCA;5875;RAMIREZ DAVALOS;U;0;;413;UNIDAD EDUCATIVA OCTAVIO CORDERO PALACIOS/COLEGIO OCTAVIO CORDERO
1;AZUAY;0;;260;CUENCA;5875;RAMIREZ DAVALOS;U;0;;5868;UNIDAD EDUCATIVA FISCOMISIONAL DANIEL HERMIDA
1;AZUAY;0;;260;CUENCA;5905;SAGRARIO;U;0;;1094;UNIDAD EDUCATIVA DOLORES J. TORRES
1;AZUAY;0;;260;CUENCA;5905;SAGRARIO;U;0;;929;UNIDAD EDUCATIVA SALESIANAS MARIA AUXILIADORA
1;AZUAY;0;;260;CUENCA;5905;SAGRARIO;U;0;;1145;UNIDAD EDUCATIVA LUISA DE JESUS CORDERO
1;AZUAY;0;;260;CUENCA;5905;SAGRARIO;U;0;;5872;UNIDAD EDUCATIVA PARTICULAR MISIONEROS OBLATOS-INGRESO CALLE BORRERO
1;AZUAY;0;;260;CUENCA;5905;SAGRARIO;U;0;;6319;CASA MUNICIPAL EX COLEGIO FEBRES CORDERO
1;AZUAY;0;;260;CUENCA;5930;SAN BLAS;U;0;;753;ESCUELA DE EDUCACION BASICA FISCOMISIONAL SOR TERESA VALSE
1;AZUAY;0;;260;CUENCA;5930;SAN BLAS;U;0;;784;ESCUELA DE EDUCACION BASICA LUIS CORDERO CRESPO
1;AZUAY;0;;260;CUENCA;5930;SAN BLAS;U;0;;698;ESCUELA DE EDUCACION BASICA MANUELA CAÑIZARES
1;AZUAY;0;;260;CUENCA;5930;SAN BLAS;U;0;;795;UNIDAD EDUCATIVA PARTICULAR CORAZON DE MARIA
1;AZUAY;0;;260;CUENCA;6010;SAN SEBASTIAN;U;0;;1429;UNIDAD EDUCATIVA SAGRADOS CORAZONES
1;AZUAY;0;;260;CUENCA;6010;SAN SEBASTIAN;U;0;;1415;UNIDAD EDUCATIVA ECUADOR
1;AZUAY;0;;260;CUENCA;6010;SAN SEBASTIAN;U;0;;1441;UNIDAD EDUCATIVA VICTOR GERARDO AGUILAR/ESCUELA REMIGIO CRESPO
1;AZUAY;0;;260;CUENCA;6010;SAN SEBASTIAN;U;0;;1519;COLEGIO DE BACHILLERATO CIUDAD DE CUENCA
1;AZUAY;0;;260;CUENCA;6010;SAN SEBASTIAN;U;0;;5884;ESCUELA DE EDUCACION BASICA ULISES CHACON
1;AZUAY;0;;260;CUENCA;6090;SUCRE;U;0;;5900;UNIVERSIDAD DE CUENCA - ADMINISTRACION CENTRAL
1;AZUAY;0;;260;CUENCA;6090;SUCRE;U;0;;981;UNIVERSIDAD DE CUENCA-FILOSOFIA
1;AZUAY;0;;260;CUENCA;6090;SUCRE;U;0;;5946;UNIVERSIDAD DE CUENCA - FACULTAD DE CIENCIAS QUIMICAS
1;AZUAY;0;;260;CUENCA;6090;SUCRE;U;0;;950;UNIDAD EDUCATIVA ANTONIO AVILA MALDONADO/COLEGIO ANTONIO AVILA MALDONADO
1;AZUAY;0;;260;CUENCA;6090;SUCRE;U;0;;975;UNIDAD EDUCATIVA MIGUEL MERCHAN OCHOA
1;AZUAY;0;;260;CUENCA;6090;SUCRE;U;0;;1022;UNIDAD EDUCATIVA REMIGIO ROMERO Y CORDERO
1;AZUAY;0;;260;CUENCA;6865;HERMANO MIGUEL;U;1;HERMANO MIGUEL;1524;UNIDAD EDUCATIVA ISABEL MOSCOSO DAVILA/ESCUELA ISABEL MOSCOSO
1;AZUAY;0;;260;CUENCA;6865;HERMANO MIGUEL;U;1;HERMANO MIGUEL;5881;ESCUELA DE EDUCACION BASICA HECTOR SEMPERTEGUI GARCIA
1;AZUAY;0;;260;CUENCA;6865;HERMANO MIGUEL;U;2;UNCOVIA;2967;UNIDAD EDUCATIVA PARTICULAR PIO 12
1;AZUAY;0;;260;CUENCA;6865;HERMANO MIGUEL;U;3;EL PROGRESO;5951;UNIDAD EDUCATIVA CARLOS RIGOBERTO VINTIMILLA
1;AZUAY;0;;265;GUALACEO;1005;DANIEL CORDOVA TORAL;R;0;;408;ESCUELA DE EDUCACIÓN BÁSICA MARIANO CUEVA
1;AZUAY;0;;265;GUALACEO;1760;LUIS CORDERO VEGA;R;0;;2026;ESCUELA DE EDUCACION BASICA REMIGIO ASTUDILLO
1;AZUAY;0;;265;GUALACEO;1805;JADAN;R;1;JADAN;368;ESCUELA DE EDUCACION BASICA TADEO TORRES
1;AZUAY;0;;265;GUALACEO;1805;JADAN;R;2;SANTA ROSA DE CHICHIN;4620;ESCUELA DE EDUCACION BASICA TERESA MORALES VILLAVICENCIO
1;AZUAY;0;;265;GUALACEO;1805;JADAN;R;3;EL CARMEN;5007;ESCUELA DE EDUCACION BASICA FEDERICO GUERRERO
1;AZUAY;0;;265;GUALACEO;2385;MARIANO MORENO/CALLASAY;R;1;MARIANO MORENO/CALLASAY;693;UNIDAD EDUCATIVA RIO TOMEBAMBA/COLEGIO NACIONAL RIO TOMEBAMBA
1;AZUAY;0;;265;GUALACEO;2385;MARIANO MORENO/CALLASAY;R;2;CERTAG;4991;CASA COMUNAL DE CERTAG
1;AZUAY;0;;265;GUALACEO;3160;REMIGIO CRESPO TORAL;R;0;;2025;ESCUELA DE EDUCACION BASICA CLUB DE LEONES DE VIRGINIA
1;AZUAY;0;;265;GUALACEO;3505;SAN JUAN;R;0;;1059;UNIDAD EDUCATIVA NICANOR AGUILAR MALDONADO
1;AZUAY;0;;265;GUALACEO;3780;SIMON BOLIVAR;R;0;;2024;ESCUELA DE EDUCACION BASICA EMILIO MOSCOSO
1;AZUAY;0;;265;GUALACEO;4340;ZHIDMAD;R;1;ZHIDMAD;2029;UNIDAD EDUCATIVA ZHIDMAD / ESCUELA DE EDUCACIÓN BÁSICA TOMÁS ORDÓÑEZ
1;AZUAY;0;;265;GUALACEO;4340;ZHIDMAD;R;2;SAN JOSE DE LALCOTE;4962;ESCUELA DE EDUCACION BASICA JOSE MARIA LOPEZ
1;AZUAY;0;;265;GUALACEO;5420;GUALACEO;U;1;GUALACEO;1173;UNIDAD EDUCATIVA SANTO DOMINGO DE GUZMAN
1;AZUAY;0;;265;GUALACEO;5420;GUALACEO;U;1;GUALACEO;1158;UNIDAD EDUCATIVA MIGUEL MALO GONZALEZ
1;AZUAY;0;;265;GUALACEO;5420;GUALACEO;U;1;GUALACEO;1058;ESCUELA DE EDUCACIÓN BÁSICA MERCEDES DE JESÚS MOLINA
1;AZUAY;0;;265;GUALACEO;5420;GUALACEO;U;1;GUALACEO;1197;ESCUELA DE EDUCACION BASICA BRASIL
1;AZUAY;0;;265;GUALACEO;5420;GUALACEO;U;1;GUALACEO;1088;UNIDAD EDUCATIVA ALFONSO LITUMA/COLEGIO ALFONSO LITUMA CORREA
1;AZUAY;0;;265;GUALACEO;5420;GUALACEO;U;1;GUALACEO;5803;UNIDAD EDUCATIVA GUALACEO
1;AZUAY;0;;265;GUALACEO;5420;GUALACEO;U;1;GUALACEO;5847;ESCUELA DE EDUCACION BASICA CIUDAD DE GUALACEO
1;AZUAY;0;;265;GUALACEO;5420;GUALACEO;U;2;BULLCAY;4963;CASA COMUNAL DE BULLCAY (EL CARMEN)
1;AZUAY;0;;270;GIRON;175;ASUNCION;R;1;LA ASUNCION;1382;UNIDAD EDUCATIVA REMIGIO CRESPO TORAL / COLEGIO REMIGIO CRESPO TORAL
1;AZUAY;0;;270;GIRON;175;ASUNCION;R;2;LENTAG;2037;UNIDAD EDUCATIVA BENIGNO JARA
1;AZUAY;0;;270;GIRON;885;SAN GERARDO;R;0;;1947;ESCUELA DE EDUCACION BASICA AGUSTIN CRESPO HEREDIA
1;AZUAY;0;;270;GIRON;5395;GIRON;U;0;;893;ESCUELA EDUCACION BASICA 27 DE FEBRERO
1;AZUAY;0;;270;GIRON;5395;GIRON;U;0;;1561;UNIDAD EDUCATIVA CIUDAD DE GIRON / COLEGIO RAFAEL CHICO PEÑAHERRERA
1;AZUAY;0;;270;GIRON;5395;GIRON;U;0;;1527;UNIDAD EDUCATIVA CIUDAD DE GIRON/COLEGIO CIUDAD DE GIRON
1;AZUAY;0;;270;GIRON;5395;GIRON;U;0;;5846;UNIDAD EDUCATIVA AGUSTIN CRESPO HEREDIA
1;AZUAY;0;;275;PAUTE;395;BULAN / J. VICTOR IZQUIERDO;R;0;;2088;ESCUELA DE EDUCACION BASICA HONORATO LOYOLA
1;AZUAY;0;;275;PAUTE;870;CHICAN / GUILLERMO ORTEGA;R;1;CHICAN /G. ORTEGA;1205;UNIDAD EDUCATIVA MANUEL J CALLE
1;AZUAY;0;;275;PAUTE;870;CHICAN / GUILLERMO ORTEGA;R;2;UZHUPUD;2960;ESCUELA DE EDUCACION BASICA MODESTO VINTIMILLA
1;AZUAY;0;;275;PAUTE;890;DUG-DUG;R;1;DUG - DUG;2053;ESCUELA DE EDUCACION BASICA JOSE DE LA VEGA
1;AZUAY;0;;275;PAUTE;890;DUG-DUG;R;2;LAZUL;2472;CASA COMUNAL LAZUL
1;AZUAY;0;;275;PAUTE;1455;GUARAINAC;R;1;GUARAINAC;2019;UNIDAD EDUCATIVA SAN PABLO DE GUARAINAC/COLEGIO LUIS VEGA GARIDO
1;AZUAY;0;;275;PAUTE;1455;GUARAINAC;R;2;JUNTAS;2535;CASA COMUNAL DE JUNTAS
1;AZUAY;0;;275;PAUTE;3375;SAN CRISTOBAL;R;1;SAN CRISTOBAL;2020;UNIDAD EDUCATIVA PIO BRAVO / ESCUELA DE EDUCACIÓN BÁSICA PIO BRAVO
1;AZUAY;0;;275;PAUTE;3375;SAN CRISTOBAL;R;2;GUACHUN;2333;ESCUELA DE EDUCACIÓN BÁSICA ALBERTO MARÍA ANDRADE
1;AZUAY;0;;275;PAUTE;4050;TOMEBAMBA;R;0;;2015;ESCUELA DE EDUCACION BASICA ANTONIO MORALES
1;AZUAY;0;;275;PAUTE;4565;EL CABO;R;0;;2343;UNIDAD EDUCATIVA ATENAS DEL ECUADOR/ESCUELA ANTONIO VEGA MUNOZ
1;AZUAY;0;;275;PAUTE;5775;PAUTE;U;1;PAUTE;1174;ESCUELA DE EDUCACIÓN BÁSICA ISIDRO AYORA
1;AZUAY;0;;275;PAUTE;5775;PAUTE;U;1;PAUTE;1165;UNIDAD EDUCATIVA 26 DE FEBRERO / ESCUELA SIMÓN BOLIVAR
1;AZUAY;0;;275;PAUTE;5775;PAUTE;U;1;PAUTE;5870;UNIDAD EDUCATIVA CIUDAD DE PAUTE
1;AZUAY;0;;275;PAUTE;5775;PAUTE;U;1;PAUTE;5860;UNIDAD EDUCATIVA FISCOMISIONAL JULIO MARIA MATOVELLE
1;AZUAY;0;;275;PAUTE;5775;PAUTE;U;2;VILLAFLOR;2754;ESCUELA DE EDUCACIÓN BÁSICA CORNELIO MOSQUERA LOPEZ
1;AZUAY;0;;275;PAUTE;5775;PAUTE;U;3;ZHUMIR;2179;ESCUELA DE EDUCACION BASICA FRANCISCO ALVARADO COBOS
1;AZUAY;0;;275;PAUTE;5775;PAUTE;U;89;VOTO EN CASA;0;
1;AZUAY;0;;280;SIGSIG;750;CUTCHIL;R;0;;32;ESCUELA DE EDUCACIÓN BÁSICA ERNESTO LOPEZ
1;AZUAY;0;;280;SIGSIG;1355;GIMA;R;0;;580;UNIDAD EDUCATIVA JIMA/ ESCUELA DE EDUCACION BASICA REMIGIO ESTEVEZ DE TORAL
1;AZUAY;0;;280;SIGSIG;1490;GUEL;R;0;;1434;ESCUELA DE EDUCACION BASICA JOSE FELIX GONZALEZ
1;AZUAY;0;;280;SIGSIG;2215;LUDO;R;1;LUDO;1170;UNIDAD EDUCATIVA AGUSTIN IGLESIAS/ESCUELA AGUSTÍN IGLESIAS
1;AZUAY;0;;280;SIGSIG;2215;LUDO;R;2;BUENA VISTA;1218;ESCUELA DE EDUCACION BASICA LUIS BENIGNO TORRES
1;AZUAY;0;;280;SIGSIG;2215;LUDO;R;3;HATOBOLO;1242;ESCUELA DE EDUCACION BASICA MANUEL J. SALCEDO
1;AZUAY;0;;280;SIGSIG;3360;SAN BARTOLOME;R;1;SAN BARTOLOMÉ;706;UNIDAD EDUCATIVA SAN BARTOLOMÉ / ESCUELA MIGUEL MORENO
1;AZUAY;0;;280;SIGSIG;3360;SAN BARTOLOME;R;2;LA LIBERTAD;818;ESCUELA DE EDUCACION BASICA EDMUNDO MALDONADO
1;AZUAY;0;;280;SIGSIG;3360;SAN BARTOLOME;R;3;SIGSIGLLANO;5024;UNIDAD EDUCATIVA JUAN BAUTISTA VASQUEZ
1;AZUAY;0;;280;SIGSIG;3495;SAN JOSE DE RARANGA;R;1;SAN JOSE DE RARANGA;1470;UNIDAD EDUCATIVA SAN JOSE DE RARANGA / ESCUELA ISAAC MARIA PEÑA
1;AZUAY;0;;280;SIGSIG;3495;SAN JOSE DE RARANGA;R;2;LA ESMERALDA;2151;ESCUELA DE EDUCACIÓN BÁSICA 5 DE NOVIEMBRE
1;AZUAY;0;;280;SIGSIG;6085;SIGSIG;U;1;SIGSIG;1345;ESCUELA DE EDUCACIÓN BÁSICA DOMINGO SAVIO
1;AZUAY;0;;280;SIGSIG;6085;SIGSIG;U;1;SIGSIG;4993;UNIDA EDUCATIVA SIGSIG
1;AZUAY;0;;280;SIGSIG;6085;SIGSIG;U;1;SIGSIG;5802;UNIDAD EDUCATIVA FISCOMISIONAL MARIA MAZZARELLO
1;AZUAY;0;;280;SIGSIG;6085;SIGSIG;U;2;PIRUNCAY;2492;ESCUELA DE EDUCACIÓN BÁSICA CARMEN ADELA CARDENAS
1;AZUAY;0;;285;SANTA ISABEL;15;ABDON CALDERON / LA UNION;R;0;;1336;UNIDAD EDUCATIVA JAIME ROLDOS AGUILERA/COLEGIO JAIME ROLDOS AGUILERA
1;AZUAY;0;;285;SANTA ISABEL;3835;SHAGLLI;R;1;SHAGLLI;1243;UNIDAD EDUCATIVA SAN PEDRO DE SHAGLLI/ESCUELA PEDRO UNDA
1;AZUAY;0;;285;SANTA ISABEL;3835;SHAGLLI;R;2;HUERTAS;3476;ESCUELA BENJAMÍN CARRIÓN
1;AZUAY;0;;285;SANTA ISABEL;3835;SHAGLLI;R;3;PUCULCAY;5000;UNIDAD EDUCATIVA SAN ALFONSO DE PUCULCAY
1;AZUAY;0;;285;SANTA ISABEL;4610;SAN SALVADOR DE CAÑARIBAMBA;R;0;;1986;ESCUELA DE EDUCACIÓN GENERAL BASICA EMILIANO HINOSTROZA
1;AZUAY;0;;285;SANTA ISABEL;6045;SANTA ISABEL;U;1;SANTA ISABEL;1328;ESCUELA DE EDUCACIÓN BÁSICA FERNANDO DE ARAGÓN
1;AZUAY;0;;285;SANTA ISABEL;6045;SANTA ISABEL;U;1;SANTA ISABEL;1252;UNIDAD EDUCATIVA SANTA ISABEL/COLEGIO SANTA ISABEL
1;AZUAY;0;;285;SANTA ISABEL;6045;SANTA ISABEL;U;1;SANTA ISABEL;1988;ESCUELA DE EDUCACION BASICA VEINTE DE ENERO
1;AZUAY;0;;285;SANTA ISABEL;6045;SANTA ISABEL;U;1;SANTA ISABEL;5856;UNIDAD EDUCATIVA LA IMACULADA
1;AZUAY;0;;285;SANTA ISABEL;6045;SANTA ISABEL;U;3;JUBONES;2002;ESCUELA DE EDUCACION BASICA RAFAEL VINTIMILLA JARA
1;AZUAY;0;;285;SANTA ISABEL;6045;SANTA ISABEL;U;89;VOTO EN CASA;0;
1;AZUAY;0;;555;PUCARA;1690;SAN RAFAEL DE SHARUG;R;1;SAN RAFAEL DE SHARUG;2089;UNIDAD EDUCATIVA SAN RAFAEL DE SHARUG / ESCUELA FAE
1;AZUAY;0;;555;PUCARA;1690;SAN RAFAEL DE SHARUG;R;2;GUARUMAL;4984;ESCUELA DE EDUCACION BASICA GUARUMAL
1;AZUAY;0;;555;PUCARA;5690;PUCARA;U;1;PUCARA;967;UNIDAD EDUCATIVA PUCARA/ESCUELA JUAN DE VELASCO
1;AZUAY;0;;555;PUCARA;5690;PUCARA;U;2;SARAYUNGA;2184;UNIDAD EDUCATIVA SARAYUNGA
1;AZUAY;0;;555;PUCARA;5690;PUCARA;U;3;GRAMALOTE;2526;ESCUELA DE EDUCACIÓN BÁSICA GRAMALOTE
1;AZUAY;0;;555;PUCARA;5690;PUCARA;U;4;CERRO NEGRO;2153;UNIDAD EDUCATIVA CORNELIO VELEZ
1;AZUAY;0;;555;PUCARA;5690;PUCARA;U;5;PELINCAY;2527;ESCUELA DE EDUCACION BASICA PELINCAY
1;AZUAY;0;;555;PUCARA;5690;PUCARA;U;7;CALIGUIÑA;1984;ESCUELA DE EDUCACION BASICA DR. ALFREDO PEREZ GUERRERO
1;AZUAY;0;;555;PUCARA;5690;PUCARA;U;8;LA DOLOROSA;2531;UNIDAD EDUCATIVA FEDERICO GONZALEZ SUAREZ/ESCUELA DE EDUCACIÓN BÁSICA FEDERICO GONZALEZ SUAREZ
1;AZUAY;0;;555;PUCARA;5690;PUCARA;U;9;LAS PALMAS;2209;ESCUELA DE EDUCACIÓN BÁSICA PROVINCIA DEL AZUAY
1;AZUAY;0;;555;PUCARA;5690;PUCARA;U;10;SANTA CECILIA;33;ESCUELA DE EDUCACIÓN BÁSICA RAMÓN MORALES VALDIVIESO
1;AZUAY;0;;555;PUCARA;5690;PUCARA;U;11;SAN ANTONIO DE ÑUGRO;5857;ESCUELA DE EDUCACION BASICA ALBERTO DURAN CHICA
1;AZUAY;0;;556;CAMILO PONCE ENRIQUEZ;1130;EL CARMEN DE PIJILI;R;0;;2258;ESCUELA DE EDUCACIÓN BÁSICA 16 DE JULIO
1;AZUAY;0;;556;CAMILO PONCE ENRIQUEZ;6875;CAMILO PONCE ENRIQUEZ;U;1;CAMILO PONCE ENRIQUEZ;1539;COLEGIO DE BACHILLERATO PONCE ENRIQUEZ
1;AZUAY;0;;556;CAMILO PONCE ENRIQUEZ;6875;CAMILO PONCE ENRIQUEZ;U;1;CAMILO PONCE ENRIQUEZ;2285;ESCUELA MIGUEL HEREDIA CRESPO
1;AZUAY;0;;556;CAMILO PONCE ENRIQUEZ;6875;CAMILO PONCE ENRIQUEZ;U;1;CAMILO PONCE ENRIQUEZ;5849;UNIDAD EDUCATIVA PARTICULAR DIVINO NIÑO
1;AZUAY;0;;556;CAMILO PONCE ENRIQUEZ;6875;CAMILO PONCE ENRIQUEZ;U;1;CAMILO PONCE ENRIQUEZ;5854;ESCUELA DE EDUCACION BASICA MERCEDES CRESPO DE VEGA
1;AZUAY;0;;556;CAMILO PONCE ENRIQUEZ;6875;CAMILO PONCE ENRIQUEZ;U;2;ZHUMIRAL;1249;UNIDAD EDUCATIVA VÍCTOR GERARDO AGUILAR/ESCUELA VICTOR GERARDO AGUILAR
1;AZUAY;0;;556;CAMILO PONCE ENRIQUEZ;6875;CAMILO PONCE ENRIQUEZ;U;3;SAN ALFONSO;1329;UNIDAD EDUCATIVA LIBERTADOR BOLIVAR
1;AZUAY;0;;556;CAMILO PONCE ENRIQUEZ;6875;CAMILO PONCE ENRIQUEZ;U;4;SANTA MARTHA;1309;ESCUELA DE EDUCACIÓN BÁSICA 16 DE ENERO
1;AZUAY;0;;556;CAMILO PONCE ENRIQUEZ;6875;CAMILO PONCE ENRIQUEZ;U;5;BELLA RICA;5021;ESCUELA DE EDUCACION BASICA EL DIAMANTE
1;AZUAY;0;;556;CAMILO PONCE ENRIQUEZ;6875;CAMILO PONCE ENRIQUEZ;U;6;SAN GERARDO;5855;UNIDAD EDUCATIVA 5 DE JUNIO
1;AZUAY;0;;780;OÑA;1540;SUSUDEL;R;0;;501;UNIDAD EDUCATIVA SUSUDEL/COLEGIO NACIONAL SUSUDEL
1;AZUAY;0;;780;OÑA;6360;OÑA;U;1;OÑA;298;UNIDAD EDUCATIVA OÑA/ COLEGIO NACIONAL OÑA
1;AZUAY;0;;780;OÑA;6360;OÑA;U;2;MORAS LOMA;2768;ESCUELA DE EDUCACIÓN BÁSICA EMILIO AREVALO
1;AZUAY;0;;855;SAN FERNANDO;4560;CHUMBLIN;R;0;;1965;ESCUELA DE EDUCACION BASICA VICTOR ALVAREZ TORRES
1;AZUAY;0;;855;SAN FERNANDO;6565;SAN FERNANDO;U;0;;1053;ESCUELA DE EDUCACION BASICA JUAN GIRON SANCHEZ
1;AZUAY;0;;885;NABON;575;COCHAPATA;R;1;COCHAPATA;2155;UNIDAD EDUCATIVA LEON VIVAR/ESCUELA DE EDUCACION BASICA ANDRES BELTRAN
1;AZUAY;0;;885;NABON;575;COCHAPATA;R;2;ÑAMARIN;2174;ESCUELA DE EDUCACION BASICA MANUEL ULPIANO ARIZAGA
1;AZUAY;0;;885;NABON;1175;EL PROGRESO;R;0;;2311;UNIDAD EDUCATIVA EL PROGRESO\ENRIQUE ARIZAGA TORAL
1;AZUAY;0;;885;NABON;2550;NIEVES;R;1;LAS NIEVES;2475;ESCUELA DE EDUCACION BASICA JUAN BAUTISTA DÁVILA
1;AZUAY;0;;885;NABON;2550;NIEVES;R;2;LA PAZ;2300;UNIDAD EDUCATIVA LA PAZ
1;AZUAY;0;;885;NABON;6595;NABON;U;1;NABON;411;UNIDAD EDUCATIVA NABON/ ESCUELA DE EDUCACIÓN BÁSICA AGUSTÍN J PERALTA
1;AZUAY;0;;885;NABON;6595;NABON;U;1;NABON;5997;UNIDAD EDUCATIVA NABON
1;AZUAY;0;;885;NABON;6595;NABON;U;2;ZHIÑA;2111;UNIDAD EDUCATIVA FRANCISCO CHICO PACHECO
1;AZUAY;0;;885;NABON;6595;NABON;U;3;RAÑAS;2071;UNIDAD EDUCATIVA COMUNITARIA INTERCULTURAL BILINGÜE/ESCUELA DE EDUCACION INTERCULTURAL BILINGÜE BASICA CESAR AGUSTIN MOROCHO
1;AZUAY;0;;885;NABON;6595;NABON;U;4;CHUNASANA;2314;UNIDAD EDUCATIVA BALTAZAR AGUIRRE
